Kobi Portföy Yöneticisi, 7.310, 3.770, 10.850,Ýþletme, Ýktisat, Kamu Yönetimi, Maliye, Çalýþma Ekonomisi ve Endüstri Ýliþkileri, Finans - Ekonomi, Telekomünikasyon, Ýletiþim Danýþmanlýðý, Danýþmanlýk, Hizmet, Anadolu Üniversitesi, Uludað Üniversitesi, Dumlupýnar Üniversitesi, Karadeniz Teknik Üniversitesi (KTÜ), Selçuk Üniversitesi, Bankacýlýk/Finans,Bilanço analizi,Bireysel Krediler,Çek-senet mevzuatý,Finans,38,
Kobi Uzmaný, 6.350, 5.000, 7.840,Ýþletme, Ýktisat, Maliye, Kamu Yönetimi, Endüstri Mühendisliði, Finans - Ekonomi, Danýþmanlýk, Hizmet, Telekomünikasyon, Mobilya & Aksesuar, Anadolu Üniversitesi, Ýstanbul Üniversitesi (ÝÜ), Dokuz Eylül Üniversitesi, Selçuk Üniversitesi, Sakarya Üniversitesi, Bankacýlýk/Finans,Bireysel Krediler,Cari Hesap ve Finans Takibi,Çek-senet mevzuatý,Dýþ Ticaret,6,
Koku Uzmaný, -, -, -, -, -, -, -, -, -, -, -, -, -, -, -, -, -, -, -, -, -, -, -, -,
Komi, 2.440, 2.020, 2.940,Turizm ve Otel Ýþletmeciliði (MYO), Ýþletme, Aþçýlýk (MYO), Turizm Ýþletmeciliði, Ýktisat, Turizm, Gýda, Eðlence - Kültür - Sanat, Hizmet, Biliþim, Anadolu Üniversitesi, Akdeniz Üniversitesi, Muðla Üniversitesi, Süleyman Demirel Üniversitesi, Selçuk Üniversitesi, AutoCAD,-, -, -, -, 145,
Komiser, 4.850, 3.000, 7.280,Güvenlik Bilimleri, Ýþletme, Kamu Yönetimi, Ýktisat, Ýþletme Yönetimi, Güvenlik, Gýda, Hizmet, Danýþmanlýk, Eðlence - Kültür - Sanat, Polis Akademisi, Anadolu Üniversitesi, Gazi Üniversitesi, Orta Doðu Teknik Üniversitesi (ODTÜ), Eskiþehir Osmangazi Üniversitesi, Adobe Dreamweaver,Adobe Photoshop,Android Uygulama Geliþtirme,Ýnsan Kaynaklarý Yönetimi,JavaScript Object Notation (JSON),3,
Konfigürasyon Mühendisi, 6.110, 2.800, 9.570,Makine Mühendisliði, Endüstri Mühendisliði, Metalurji ve Malzeme Mühendisliði, Elektrik/Elektronik Mühendisliði, Bilgisayar Mühendisliði, Üretim / Endüstriyel Ürünler, Otomotiv, Telekomünikasyon, Havacýlýk, Yapý, Orta Doðu Teknik Üniversitesi (ODTÜ), Kocaeli Üniversitesi, Dokuz Eylül Üniversitesi, Hacettepe Üniversitesi, Ýstanbul Teknik Üniversitesi (ÝTÜ), AutoCAD,C#,C++,Catia V5,ERP,6,
Konsiyerj , -, -, -, Turizm ve Otel Ýþletmeciliði (MYO), Konaklama Ýþletmeciliði, Turizm Ýþletmeciliði, Ýþletme, Turizm Ýþletmeciliði ve Otelcilik, Turizm, Hizmet, Danýþmanlýk, Gýda, Eðlence - Kültür - Sanat, Anadolu Üniversitesi, Akdeniz Üniversitesi, Ýstanbul Üniversitesi (ÝÜ), Balýkesir Üniversitesi, Dokuz Eylül Üniversitesi, Planlama Ve Organizasyon,-, -, -, -, -,
Konsolidasyon Yöneticisi, -, -, -, -, -, -, -, -, -, -, -, -, -, -, -, -, -, -, -, -, -, -, -, -,
Konsolos, -, -, -, -, -, -, -, -, -, -, -, -, -, -, -, -, -, -, -, -, -, -, -, -,
Konstrüksiyon Mühendisi, 4.370, 2.500, 8.460,Makine Mühendisliði, Ýnþaat Mühendisliði, Gemi Ýnþa Mühendisliði, Otomotiv Mühendisliði, Gemi Ýnþaatý ve Gemi Makineleri Mühendisliði, Otomotiv, Yapý, Enerji, Üretim / Endüstriyel Ürünler, Hizmet, Ýstanbul Teknik Üniversitesi (ÝTÜ), Kocaeli Üniversitesi, Uludað Üniversitesi, Ýstanbul Üniversitesi (ÝÜ), Sakarya Üniversitesi, Ansys,Ansys Workbench,AutoCAD,Autodesk Inventor,CATIA,3,
Konstrüktör  , 5.400, 2.380, 8.910,Makine (MYO), Makine-Resim-Konstrüksiyon (MYO), Makine Mühendisliði, Tasarým ve Konstrüksiyon Öðretmenliði, Makine Resmi ve Konstrüksiyonu Öðretmenliði, Otomotiv, Üretim / Endüstriyel Ürünler, Hizmet, Yapý, Enerji, Sakarya Üniversitesi, Gazi Üniversitesi, Afyon Kocatepe Üniversitesi, Bülent Ecevit Üniversitesi, Anadolu Üniversitesi, AutoCAD,Bakým Planlama,CAD/CAM,CATIA,Catia V5,7,
Kontrol Mühendisi, 3.880, 2.020, 5.780,Ýnþaat Mühendisliði, Makine Mühendisliði, Elektrik/Elektronik Mühendisliði, Jeoloji Mühendisliði, Ýnþaat (MYO), Yapý, Hizmet, Enerji, Elektrik & Elektronik, Maden ve Metal Sanayi, Karadeniz Teknik Üniversitesi (KTÜ), Yýldýz Teknik Üniversitesi (YTÜ), Fýrat Üniversitesi, Selçuk Üniversitesi, Ýstanbul Teknik Üniversitesi (ÝTÜ), AutoCAD,Bina Mekanik Sistemleri,Bina Sýhhi Tesisatý,Borulama,Fiyat Analizleri,157,
Kontrol ve Otomasyon Teknikeri, 3.720, 2.600, 5.400, Kontrol ve Otomasyon Teknolojisi, Endüstriyel Otomasyon (MYO), Mekatronik (MYO), Elektronik Teknolojisi, Elektrik (MYO), Elektrik & Elektronik, Biliþim, Enerji, Yapý, Gýda, Kocaeli Üniversitesi, Düzce Üniversitesi, Akdeniz Üniversitesi, Ege Üniversitesi, Mersin Üniversitesi, AutoCAD,Devre Tasarýmý,Elektrik Kumanda Panolarý,Elektrik Motorlarý,Elektrik/Elektronik,15,
Kontrolör, 4.160, 2.020, 6.510,Ýþletme, Ýktisat, Ýnþaat Mühendisliði, Þehir Planlama, Ýnþaat (MYO), Hizmet, Yapý, Finans - Ekonomi, Otomotiv, Tarým / Ziraat, Anadolu Üniversitesi, Ýstanbul Üniversitesi (ÝÜ), Ankara Üniversitesi, Ege Üniversitesi, Gazi Üniversitesi, AutoCAD,Bankacýlýk/Finans,Depo Ve Stok Yönetimi,IFRS (Uluslararasý finansal raporlama standartlarý),Ýstatistiksel analiz,30,
Koreograf, 3.500, 2.500, 5.480,-, -, -, -, -, -, -, -, -, -, -, -, -, -, -, -, -, -, -, -, 3,
Köpek Eðitmeni, -, -, -, Muhasebe (MYO), Laborant ve Veteriner Saðlýk  (MYO), Sivil Hava Ulaþtýrma Ýþletmeciliði (MYO), Bilgisayar Teknolojisi ve Programlama (MYO), Atçýlýk Ýþletmeciliði (MYO), Hayvancýlýk, Eðitim, Güvenlik, Tarým / Ziraat, Havacýlýk, Anadolu Üniversitesi, Selçuk Üniversitesi, Ýstanbul Üniversitesi (ÝÜ), Çanakkale 18 Mart Üniversitesi, Balýkesir Üniversitesi, Elektrik/Elektronik,Ýþ Saðlýðý Ve Güvenliði,OHSAS 18001 Ýþçi Saðlýðý ve Ýþ Güvenliði Standartý,-, -, -,
Köþe Yazarý, -, -, -, Gazetecilik, Psikoloji, Uluslararasý Ýliþkiler, Ýþletme, Türk Dili ve Edebiyatý, Medya, Basým - Yayýn, Biliþim, Eðitim, Eðlence - Kültür - Sanat, Anadolu Üniversitesi, Ýstanbul Üniversitesi (ÝÜ), Ankara Üniversitesi, Marmara Üniversitesi, Kocaeli Üniversitesi, Adobe Photoshop,AutoCAD,Finans,Genel Muhasebe,Metin Yazarlýðý,-,
Kreatif Direktör, 7.320, 3.990, 10.640,Grafik Tasarýmý, Görsel Ýletiþim Tasarýmý, Ýþletme, Halkla Ýliþkiler ve Reklamcýlýk, Moda ve Tekstil Tasarýmý, Reklam ve Tanýtým, Medya, Tekstil, Basým - Yayýn, Biliþim, Anadolu Üniversitesi, Marmara Üniversitesi, Ýstanbul Üniversitesi (ÝÜ), Dokuz Eylül Üniversitesi, Mimar Sinan Güzel Sanatlar Üniversitesi, 3D Studio Max,3D Tasarým ve Modelleme Uygulamasý,Adobe After Effects,Adobe Dreamweaver,Adobe Illustrator,30,
Kredi Analisti, 5.870, 2.400, 9.900,Ýþletme, Ýktisat, Endüstri Mühendisliði, Ekonomi, Matematik, Finans - Ekonomi, Otomotiv, Hizmet, Danýþmanlýk, Enerji, Marmara Üniversitesi, Ýstanbul Üniversitesi (ÝÜ), Anadolu Üniversitesi, Orta Doðu Teknik Üniversitesi (ODTÜ), Ýstanbul Teknik Üniversitesi (ÝTÜ), Bankacýlýk/Finans,Bilanço analizi,Finansal Analiz,Finansal Raporlama,Finansal tablo analizi,20,
Kredi Derecelendirme Uzmaný, -, -, -, -, -, -, -, -, -, -, -, -, -, -, -, -, -, -, -, -, -, -, -, -,
Kredi Tahsis Uzmaný, 8.040, 4.000, 12.090,Ýþletme, Ýktisat, Ýktisat (Ýngilizce), Ýþletme (Ýngilizce), Matematik, Finans - Ekonomi, Danýþmanlýk, Otomotiv, Hizmet, Biliþim, Ýstanbul Üniversitesi (ÝÜ), Marmara Üniversitesi, Dokuz Eylül Üniversitesi, Anadolu Üniversitesi, Gazi Üniversitesi, Bankacýlýk/Finans,Bilanço analizi,Finans,Finansal Analiz,Finansal Raporlama,27,
Kredi Uzmaný, 4.380, 2.900, 6.690,Ýþletme, Ýktisat, Maliye, Ýþletme (Ýngilizce), Kamu Yönetimi, Finans - Ekonomi, Otomotiv, Hizmet, Danýþmanlýk, Turizm, Anadolu Üniversitesi, Ýstanbul Üniversitesi (ÝÜ), Dokuz Eylül Üniversitesi, Kocaeli Üniversitesi, Marmara Üniversitesi, Bireysel Krediler,Cari Hesap ve Finans Takibi,Finansal Analiz,Finansal planlama/kontrol,Finansal Raporlama,7,
Kreþ Öðretmeni, 2.480, 2.020, 3.260,Çocuk Geliþimi (MYO), Sosyal Hizmetler, Çocuk Geliþimi ve Eðitimi, Ýlahiyat, Çocuk Geliþimi ve Eðitimi Öðretmenliði, Eðitim, Hizmet, Gýda, Turizm, Eðlence - Kültür - Sanat, Anadolu Üniversitesi, Atatürk Üniversitesi, Süleyman Demirel Üniversitesi, Kýrýkkale Üniversitesi, Kýrklareli Üniversitesi, Çocuk Geliþimi,Ön Muhasebe,-, -, -, 4,
Kule Vinç Operatörü, 4.430, 3.280, 5.570,Ýþletme, Ýnþaat (MYO), Kamu Yönetimi, Elektrik (MYO), Ýktisat, Yapý, Üretim / Endüstriyel Ürünler, Maden ve Metal Sanayi, Denizcilik, Biliþim, Anadolu Üniversitesi, Atatürk Üniversitesi, Dumlupýnar Üniversitesi, Karadeniz Teknik Üniversitesi (KTÜ), Gazi Üniversitesi, Elektrik Kumanda Panolarý,Forklift Operatörü,Tavan Vinç Operatörü,Üst Yapý Ýnþaatlarý,-, 54,
Kullanýcý Deneyimi Uzmaný, 5.330, 2.500, 9.350,Endüstri Ürünleri Tasarýmý, Endüstriyel Tasarým, Bilgisayar Teknolojisi ve Programlama (MYO), Grafik Tasarýmý, Ýþletme, Biliþim, Finans - Ekonomi, Danýþmanlýk, Ticaret, Medya, Orta Doðu Teknik Üniversitesi (ODTÜ), Ýstanbul Teknik Üniversitesi (ÝTÜ), Anadolu Üniversitesi, Ýhsan Doðramacý Bilkent Üniversitesi, Ýstanbul Aydýn Üniversitesi, Adobe After Effects,Adobe Dreamweaver,Adobe Flash,Adobe Illustrator,Adobe Photoshop,10,
Kurgu Yönetmeni, 4.270, 2.750, 6.530,Radyo - Sinema ve Televizyon, Radyo ve Televizyon Programcýlýðý (MYO), Sinema ve Televizyon, Radyo ve Televizyon Yayýmcýlýðý (MYO), Ýþletme, Medya, Reklam ve Tanýtým, Basým - Yayýn, Eðlence - Kültür - Sanat, Biliþim, Anadolu Üniversitesi, Ýstanbul Üniversitesi (ÝÜ), Ýstanbul Aydýn Üniversitesi, Gazi Üniversitesi, Marmara Üniversitesi, Adobe After Effects,Adobe Illustrator,Adobe Photoshop,Adobe Photoshop CC,Adobe Premiere,11,
Kurumsal Danýþman, -, -, -, Ýþletme, Ýktisat, Ýþletme Yönetimi, Bilgisayar Teknolojisi ve Programlama (MYO), Dýþ Ticaret (MYO), Telekomünikasyon, Danýþmanlýk, Hizmet, Biliþim, Eðitim, Anadolu Üniversitesi, Ýstanbul Üniversitesi (ÝÜ), Kocaeli Üniversitesi, Selçuk Üniversitesi, Çukurova Üniversitesi, Ýnsan Kaynaklarý Yönetimi,-, -, -, -, -,
Kurumsal Ýletiþim Direktörü, 6.330, 3.500, 10.210,Ýþletme, Halkla Ýliþkiler ve Tanýtým, Gazetecilik, Halkla Ýliþkiler, Kamu Yönetimi, Eðitim, Saðlýk, Medya, Reklam ve Tanýtým, Danýþmanlýk, Ýstanbul Üniversitesi (ÝÜ), Anadolu Üniversitesi, Marmara Üniversitesi, Boðaziçi Üniversitesi, Uludað Üniversitesi, Adobe Photoshop,Dijital Pazarlama,Marketing,Mikro,Pazarlama Stratejisi,11,
Kurumsal Ýletiþim Müdürü, 6.700, 3.390, 10.810,Ýþletme, Halkla Ýliþkiler ve Tanýtým, Gazetecilik, Halkla Ýliþkiler, Halkla Ýliþkiler ve Reklamcýlýk, Saðlýk, Eðitim, Gýda, Topluluklar, Yapý, Ýstanbul Üniversitesi (ÝÜ), Anadolu Üniversitesi, Marmara Üniversitesi, Ýstanbul Bilgi Üniversitesi, Boðaziçi Üniversitesi, Adobe Illustrator,Adobe Photoshop,Dijital Pazarlama,Google Adwords Kampanya Yönetimi,Marketing communications,51,
Kurumsal Ýletiþim Uzman Yardýmcýsý, 3.210, 2.020, 4.810,Halkla Ýliþkiler ve Tanýtým, Ýþletme, Halkla Ýliþkiler, Uluslararasý Ýliþkiler, Halkla Ýliþkiler ve Reklamcýlýk, Finans - Ekonomi, Topluluklar, Saðlýk, Eðitim, Hizmet, Ýstanbul Üniversitesi (ÝÜ), Marmara Üniversitesi, Anadolu Üniversitesi, Ýstanbul Bilgi Üniversitesi, Bahçeþehir Üniversitesi, Adobe Illustrator,Adobe Photoshop,Dijital Pazarlama,Photoshop,Sosyal Medya Yönetimi,17,
Kurumsal Ýletiþim Uzmaný, 3.770, 2.020, 5.580,Halkla Ýliþkiler ve Tanýtým, Ýþletme, Halkla Ýliþkiler ve Reklamcýlýk, Gazetecilik, Radyo - Sinema ve Televizyon, Eðitim, Saðlýk, Yapý, Topluluklar, Hizmet, Anadolu Üniversitesi, Marmara Üniversitesi, Ýstanbul Üniversitesi (ÝÜ), Kocaeli Üniversitesi, Yeditepe Üniversitesi, Adobe Illustrator,Adobe Photoshop,Dijital Pazarlama,Halkla Ýliþkiler,Pazarlama Stratejisi,127,
Kurumsal Ýletiþim Yöneticisi / Yönetmeni, 6.280, 3.000, 10.210,Halkla Ýliþkiler ve Tanýtým, Ýþletme, Halkla Ýliþkiler ve Reklamcýlýk, Halkla Ýliþkiler, Gazetecilik, Eðitim, Reklam ve Tanýtým, Yapý, Finans - Ekonomi, Biliþim, Ýstanbul Üniversitesi (ÝÜ), Marmara Üniversitesi, Anadolu Üniversitesi, Kocaeli Üniversitesi, Ege Üniversitesi, Adobe Illustrator,Adobe Photoshop,CRM,Dijital Pazarlama,Google Adwords Kampanya Yönetimi,23,
Kurumsal Ýliþkiler Uzmaný, 4.910, 3.500, 7.680,Ýþletme, Uluslararasý Ýliþkiler, Ýktisat, Ýþletme (Ýngilizce), Turizm ve Otel Ýþletmeciliði (MYO), Saðlýk, Eðitim, Gýda, Hizmet, Biliþim, Anadolu Üniversitesi, Ankara Üniversitesi, Orta Doðu Teknik Üniversitesi (ODTÜ), Marmara Üniversitesi, Ýstanbul Üniversitesi (ÝÜ), French,Halkla Ýliþkiler,Proje Yönetimi,Raporlama,Sosyal Medya Yönetimi,4,
Kurumsal Müþteri Temsilcisi, 2.760, 2.020, 3.710,Ýþletme, Ýktisat, Kamu Yönetimi, Halkla Ýliþkiler ve Tanýtým, Uluslararasý Ýliþkiler, Telekomünikasyon, Hizmet, Biliþim, Finans - Ekonomi, Taþýmacýlýk, Anadolu Üniversitesi, Atatürk Üniversitesi, Ýstanbul Üniversitesi (ÝÜ), Dumlupýnar Üniversitesi, Selçuk Üniversitesi, Adobe Photoshop,CRM,Photoshop,SAP,Satýþ Yönetimi,44,
Kurumsal Pazarlama Uzmaný, 2.840, 2.020, 3.720,Ýþletme, Ýktisat, Ýþletme (Ýngilizce), Uluslararasý Ýliþkiler, Saðlýk Yönetimi, Saðlýk, Finans - Ekonomi, Hizmet, Telekomünikasyon, Sigortacýlýk, Anadolu Üniversitesi, Ýstanbul Üniversitesi (ÝÜ), Marmara Üniversitesi, Uludað Üniversitesi, Karadeniz Teknik Üniversitesi (KTÜ), Adobe Photoshop,AutoCAD,Bankacýlýk/Finans,Bütçe planlama ve raporlama,Dijital Pazarlama,25,
Kurumsal Satýþ Danýþmaný, 3.070, 2.020, 4.470,Ýþletme, Kamu Yönetimi, Ýktisat, Çalýþma Ekonomisi ve Endüstri Ýliþkileri, Bilgisayar Teknolojisi ve Programlama (MYO), Telekomünikasyon, Tekstil, Biliþim, Ýletiþim Danýþmanlýðý, Hizmet, Anadolu Üniversitesi, Kocaeli Üniversitesi, Süleyman Demirel Üniversitesi, Ýstanbul Üniversitesi (ÝÜ), Selçuk Üniversitesi, Genel Muhasebe,Kurumsal Satýþ,Satýþ Yönetimi,-, -, 49,
Kurumsal Satýþ Müdürü, 5.730, 2.200, 9.310,Ýþletme, Ýktisat, Bilgisayar Teknolojisi ve Programlama (MYO), Turizm Ýþletmeciliði, Turizm - Otelcilik, Telekomünikasyon, Biliþim, Turizm, Eðitim, Sigortacýlýk, Anadolu Üniversitesi, Ýstanbul Üniversitesi (ÝÜ), Marmara Üniversitesi, Uludað Üniversitesi, Çukurova Üniversitesi, AutoCAD,Bütçe planlama ve raporlama,CRM,Depo Ve Lojistik Yönetimi,Ýþ ve süreç analizi,17,
Kurumsal Satýþ Temsilcisi, 2.410, 2.020, 3.260,Ýþletme, Ýktisat, Kamu Yönetimi, Bilgisayar Teknolojisi ve Programlama (MYO), Turizm ve Otel Ýþletmeciliði (MYO), Telekomünikasyon, Biliþim, Ýletiþim Danýþmanlýðý, Turizm, Hizmet, Anadolu Üniversitesi, Dokuz Eylül Üniversitesi, Ýstanbul Üniversitesi (ÝÜ), Kocaeli Üniversitesi, Dumlupýnar Üniversitesi, Adobe Photoshop,AutoCAD,Satýþ Yönetimi,-, -, 38,
Kurumsal Satýþ Uzmaný, 3.540, 2.220, 4.860,Ýþletme, Uluslararasý Ýliþkiler, Ýktisat, Pazarlama (MYO), Kamu Yönetimi, Telekomünikasyon, Biliþim, Sigortacýlýk, Hizmet, Turizm, Anadolu Üniversitesi, Ýstanbul Üniversitesi (ÝÜ), Kocaeli Üniversitesi, Sakarya Üniversitesi, Uludað Üniversitesi, Bütçe planlama ve raporlama,CRM,Kurumsal Satýþ,Pazarlama Stratejisi,Proje Yönetimi,40,
Kurye, 2.610, 2.030, 3.180,Ýþletme, Lojistik (MYO), Kamu Yönetimi, Ýktisat, Dýþ Ticaret (MYO), Taþýmacýlýk, Gýda, Hizmet, Saðlýk, Turizm, Anadolu Üniversitesi, Kocaeli Üniversitesi, Süleyman Demirel Üniversitesi, Selçuk Üniversitesi, Uludað Üniversitesi, Bilgisayar,Futbol,Microsoft Office,Ticaret,Personel Maliyet,310,
Laborant, 2.820, 2.020, 3.680,TÄ±bbi Laboratuvar (MYO), Laborant ve Veteriner SaÄlÄ±k  (MYO), T±bbi Laboratuvar Teknikeri  , Biyoloji, Kimya, SaÄlÄ±k, Tekstil, Hizmet, Kimya, GÄ±da, Anadolu Üniversitesi, Kocaeli Üniversitesi, UludaÄ Üniversitesi, Manisa Celal Bayar Üniversitesi, Trakya Üniversitesi, Kan Alma,Laboratuvar,Mikrobiyoloji,-, -, 248,
Laboratuvar Elemaný, 2.560, 2.020, 3.150,Biyoloji, Kimya, Kimya Teknolojisi (MYO), Týbbi Laboratuvar (MYO), Kimya (MYO), Saðlýk, Tekstil, Kimya, Gýda, Hizmet, Anadolu Üniversitesi, Kocaeli Üniversitesi, Ege Üniversitesi, Trakya Üniversitesi, Manisa Celal Bayar Üniversitesi, AutoCAD,Ýþçi Saðlýðý ve Ýþ Güvenliði,Kan Alma,Laboratuvar,Mikrobiyoloji,62,
Laboratuvar Mühendisi, 3.850, 2.570, 6.180,Kimya Mühendisliði, Metalurji ve Malzeme Mühendisliði, Jeoloji Mühendisliði, Kimya, Makine Mühendisliði, Kimya, Yapý, Maden ve Metal Sanayi, Hizmet, Ev Eþyalarý, Ýstanbul Teknik Üniversitesi (ÝTÜ), Ege Üniversitesi, Marmara Üniversitesi, Hacettepe Üniversitesi, Yýldýz Teknik Üniversitesi (YTÜ), AutoCAD,Catia V5,ISO 9001,Java,Kalite / AR-GE,10,
Laboratuvar Sorumlusu, 3.660, 2.180, 5.130,Kimya, Biyoloji, Týbbi Laboratuvar (MYO), Kimya Mühendisliði, Gýda Teknolojisi (MYO), Saðlýk, Kimya, Gýda, Tekstil, Hizmet, Ege Üniversitesi, Anadolu Üniversitesi, Kocaeli Üniversitesi, Uludað Üniversitesi, Ýstanbul Üniversitesi (ÝÜ), Analiz Yöntemleri,AutoCAD,GCMS / HPLC,ISO 14001,ISO 9001,80,
Laboratuvar Teknikeri, 2.580, 2.020, 3.290,Týbbi Laboratuvar (MYO), Týbbi Laboratuvar Teknikeri  , Laboratuvar (MYO), Laborant ve Veteriner Saðlýk  (MYO), Kimya Teknolojisi (MYO), Saðlýk, Hizmet, Kimya, Gýda, Yapý, Kocaeli Üniversitesi, Anadolu Üniversitesi, Marmara Üniversitesi, Uludað Üniversitesi, Sakarya Üniversitesi, Ýþçi Saðlýðý ve Ýþ Güvenliði,Kan Alma,Laboratuvar,Mikrobiyoloji,-, 190,
Laboratuvar Teknisyeni, 3.070, 2.020, 4.460,Týbbi Laboratuvar (MYO), Biyoloji, Týbbi Laboratuvar Teknikeri  , Kimya, Laboratuvar (MYO), Saðlýk, Hizmet, Kimya, Yapý, Tekstil, Anadolu Üniversitesi, Kocaeli Üniversitesi, Ýstanbul Üniversitesi (ÝÜ), Ege Üniversitesi, Marmara Üniversitesi, Kalibrasyon,Kalite Yönetim Sistemleri,Kan Alma,Laboratuvar,Mikrobiyoloji,64,
Laminant Ustasý, -, -, -, Kamu Yönetimi, Ýþletme, Ýþletme Yönetimi, Muhasebe Bilgi Sistemleri, Moda ve Tekstil Tasarýmý, Yapý, Mobilya & Aksesuar, Orman Ürünleri, Atýk Yönetimi ve Geri Dönüþüm, Tarým / Ziraat, Anadolu Üniversitesi, Bülent Ecevit Üniversitesi, Uþak Üniversitesi, Kýrýkkale Üniversitesi, Avrasya Üniversitesi, Bilgisayar Destekli Tasarým Araçlarý,-, -, -, -, -,
Lazer Kesim Operatörü, 2.660, 2.250, 3.110,Makine (MYO), Otomotiv (MYO), Makine, Elektronik Teknolojisi, Bilgisayar Teknolojisi ve Programlama (MYO), Maden ve Metal Sanayi, Otomotiv, Tekstil, Üretim / Endüstriyel Ürünler, Biliþim, Anadolu Üniversitesi, Kocaeli Üniversitesi, Afyon Kocatepe Üniversitesi, Dokuz Eylül Üniversitesi, Süleyman Demirel Üniversitesi, Adobe Photoshop,AutoCAD,Bilgisayar Destekli Tasarým Araçlarý,C Programming Language,Kalite Kontrol,7,
Liman Operasyon Elemaný, 2.720, 2.250, 3.300,Deniz ve Liman Ýþletme (MYO), Dýþ Ticaret (MYO), Denizcilik Ýþletmeleri Yönetimi, Lojistik (MYO), Ýþletme, Denizcilik, Taþýmacýlýk, Hizmet, Ticaret, Enerji, Anadolu Üniversitesi, Kocaeli Üniversitesi, Mersin Üniversitesi, Bülent Ecevit Üniversitesi, Çanakkale 18 Mart Üniversitesi, Elektrik/Elektronik,Forklift Operatörü,Ýþçi Saðlýðý ve Ýþ Güvenliði,Lojistik,-, 16,
Linux Sistem Uzmaný, 4.160, 3.200, 5.870,Bilgisayar Mühendisliði, Bilgisayar Teknolojisi ve Programlama (MYO), Elektronik ve Haberleþme Müh., Elektrik/Elektronik Mühendisliði, Yazýlým Mühendisliði, Biliþim, Telekomünikasyon, Finans - Ekonomi, Eðitim, Ticaret, Ýstanbul Teknik Üniversitesi (ÝTÜ), Anadolu Üniversitesi, Orta Doðu Teknik Üniversitesi (ODTÜ), Fýrat Üniversitesi, Sakarya Üniversitesi, Apache HTTP Server,C++,Cisco Routers,DNS,jQuery,38,
Linux Sistem Yöneticisi, 4.710, 2.980, 6.450,Bilgisayar Mühendisliði, Elektrik/Elektronik Mühendisliði, Elektronik ve Haberleþme Müh., Bilgisayar Teknolojisi ve Programlama (MYO), Biyoloji, Biliþim, Telekomünikasyon, Finans - Ekonomi, Elektrik & Elektronik, Sigortacýlýk, Sakarya Üniversitesi, Ýstanbul Teknik Üniversitesi (ÝTÜ), Yýldýz Teknik Üniversitesi (YTÜ), Ondokuz Mayýs Üniversitesi, Ankara Üniversitesi, Apache HTTP Server,C,Java,LAN (Local Area Network),Linux,33,
Loder Operatörü, 3.630, 2.690, 4.560,Makine (MYO), Ýþletme, Dýþ Ticaret (MYO), Muhasebe, Makine, Yapý, Maden ve Metal Sanayi, Üretim / Endüstriyel Ürünler, Taþýmacýlýk, Enerji, Anadolu Üniversitesi, Cumhuriyet Üniversitesi, Muðla Üniversitesi, Çukurova Üniversitesi, Manisa Celal Bayar Üniversitesi, Forklift Operatörü,Operatör,-, -, -, 33,
Logo Tasarýmcýsý, -, -, -, -, -, -, -, -, -, -, -, -, -, -, -, -, -, -, -, -, -, -, -, -,
Lojistik Depo Elemaný, 2.610, 2.020, 3.330,Lojistik (MYO), Ýþletme, Dýþ Ticaret (MYO), Lojistik Yönetimi, Ýþletme Yönetimi, Taþýmacýlýk, Otomotiv, Tekstil, Gýda, Saðlýk, Anadolu Üniversitesi, Kocaeli Üniversitesi, Sakarya Üniversitesi, Dumlupýnar Üniversitesi, Süleyman Demirel Üniversitesi, Depo Operasyon,Depo Stok Takibi,Depo Ve Lojistik Yönetimi,Depo Ve Stok Yönetimi,Forklift Ehliyeti,128,
Lojistik Depo Sorumlusu, 3.280, 2.190, 4.380,Ýþletme, Lojistik (MYO), Kamu Yönetimi, Muhasebe (MYO), Ýktisat, Taþýmacýlýk, Otomotiv, Gýda, Tekstil, Saðlýk, Anadolu Üniversitesi, Dumlupýnar Üniversitesi, Kocaeli Üniversitesi, Selçuk Üniversitesi, Uludað Üniversitesi, Cari Hesap ve Finans Takibi,Depo Operasyon,Depo Stok Takibi,Depo Ve Lojistik Yönetimi,Depo Ve Stok Yönetimi,80,
Lojistik Müdürü, 8.010, 3.520, 12.490,Endüstri Mühendisliði, Ýþletme, Ýktisat, Makine Mühendisliði, Kamu Yönetimi, Taþýmacýlýk, Otomotiv, Gýda, Yapý, Kimya, Anadolu Üniversitesi, Ýstanbul Üniversitesi (ÝÜ), Dokuz Eylül Üniversitesi, Uludað Üniversitesi, Marmara Üniversitesi, Bütçe planlama ve raporlama,Depo Operasyon,Depo Stok Takibi,Depo Ve Lojistik Yönetimi,Depo Ve Stok Yönetimi,111,
Lojistik Mühendisi, 4.570, 2.750, 6.550,Endüstri Mühendisliði, Makine Mühendisliði, Metalurji ve Malzeme Mühendisliði, Kimya Mühendisliði, Ýþletme, Otomotiv, Taþýmacýlýk, Üretim / Endüstriyel Ürünler, Gýda, Yapý, Uludað Üniversitesi, Yýldýz Teknik Üniversitesi (YTÜ), Eskiþehir Osmangazi Üniversitesi, Sakarya Üniversitesi, Anadolu Üniversitesi, 5S,AutoCAD,CATIA,Depo Ve Lojistik Yönetimi,Depo Ve Stok Yönetimi,35,
Lojistik Operasyon Sorumlusu, 3.040, 2.020, 4.130,Lojistik (MYO), Ýþletme, Dýþ Ticaret (MYO), Ýktisat, Lojistik Yönetimi, Taþýmacýlýk, Gýda, Otomotiv, Üretim / Endüstriyel Ürünler, Ticaret, Anadolu Üniversitesi, Dumlupýnar Üniversitesi, Kocaeli Üniversitesi, Ýstanbul Üniversitesi (ÝÜ), Sakarya Üniversitesi, Depo Operasyon,Depo Stok Takibi,Depo Ve Lojistik Yönetimi,Dýþ Ticaret,ERP Lojistik,19,
Lojistik Operasyon Uzmaný, 3.530, 2.500, 4.960,Lojistik (MYO), Ýþletme, Lojistik Yönetimi, Endüstri Mühendisliði, Dýþ Ticaret (MYO), Taþýmacýlýk, Gýda, Ticaret, Üretim / Endüstriyel Ürünler, Tekstil, Anadolu Üniversitesi, Kocaeli Üniversitesi, Dumlupýnar Üniversitesi, Balýkesir Üniversitesi, Ýstanbul Arel Üniversitesi, Depo Operasyon,Depo Stok Takibi,Depo Ve Lojistik Yönetimi,Depo Ve Stok Yönetimi,Dýþ Ticaret,19,
Lojistik Planlama Uzmaný, 6.220, 4.030, 8.410,Endüstri Mühendisliði, Ýþletme, Lojistik (MYO), Uluslararasý Ýliþkiler, Ýstatistik, Taþýmacýlýk, Otomotiv, Gýda, Maden ve Metal Sanayi, Tekstil, Anadolu Üniversitesi, Kocaeli Üniversitesi, Ýstanbul Üniversitesi (ÝÜ), Sakarya Üniversitesi, Dumlupýnar Üniversitesi, Depo Ve Lojistik Yönetimi,Depo Ve Stok Yönetimi,Lojistik Planlama,MRP1 (Malzeme Ýhtiyaç Planlamasý),MRP2 (Ýmalat Kaynak Planlamasý),7,
Lojistik Uzmaný, 3.910, 2.020, 5.940,Ýþletme, Endüstri Mühendisliði, Lojistik (MYO), Uluslararasý Ýliþkiler, Ýktisat, Taþýmacýlýk, Otomotiv, Saðlýk, Enerji, Gýda, Anadolu Üniversitesi, Kocaeli Üniversitesi, Ýstanbul Üniversitesi (ÝÜ), Uludað Üniversitesi, Marmara Üniversitesi, Depo Operasyon,Depo Stok Takibi,Depo Ve Lojistik Yönetimi,Depo Ve Stok Yönetimi,ERP Lojistik,159,
Maden Mühendisi, 4.490, 2.610, 6.380,Maden Mühendisliði, Maden (MYO), Mermer Teknolojisi (MYO), Ýþletme, Ýnþaat (MYO), Maden ve Metal Sanayi, Yapý, Hizmet, Enerji, Üretim / Endüstriyel Ürünler, Çukurova Üniversitesi, Cumhuriyet Üniversitesi, Süleyman Demirel Üniversitesi, Dumlupýnar Üniversitesi, Selçuk Üniversitesi, AutoCAD,ÝSÝG (Ýþçi Saðlýðý ve Ýþ Güvenliði) Mevzuatý,Ýþçi Saðlýðý ve Ýþ Güvenliði,Madencilik,NETCAD,233,
Maden Teknikeri, 4.180, 2.890, 5.470,Maden (MYO), Ýþletme, Maden Mühendisliði, Makine, Bilgisayar Teknolojisi ve Programlama (MYO), Maden ve Metal Sanayi, Yapý, Üretim / Endüstriyel Ürünler, Enerji, Gýda, Manisa Celal Bayar Üniversitesi, Balýkesir Üniversitesi, Çanakkale 18 Mart Üniversitesi, Bülent Ecevit Üniversitesi, Cumhuriyet Üniversitesi, AutoCAD,NETCAD,Stok Yönetimi,-, -, 20,
Maden Yüksek Mühendisi, -, -, -, -, -, -, -, -, -, -, -, -, -, -, -, -, -, -, -, -, -, -, -, -,
Maðaza Görevlisi, 2.800, 2.200, 3.430,Ýþletme, Ýktisat, Kamu Yönetimi, Ýþletme Yönetimi, Bilgisayar Teknolojisi ve Programlama (MYO), Ticaret, Tekstil, Gýda, Perakende, Hizmet, Anadolu Üniversitesi, Süleyman Demirel Üniversitesi, Dumlupýnar Üniversitesi, Ýstanbul Üniversitesi (ÝÜ), Kocaeli Üniversitesi, Genel Muhasebe,Ýstatistiksel analiz,Muhasebe,Satýþ Yönetimi,-, 36,
Maðaza Görsel Sorumlusu, 2.500, 2.020, 3.020,Ýþletme, Ýþletme Yönetimi, Kamu Yönetimi, Dýþ Ticaret (MYO), Ýktisat, Tekstil, Perakende, Ticaret, Ev Eþyalarý, Gýda, Anadolu Üniversitesi, Ýstanbul Üniversitesi (ÝÜ), Kocaeli Üniversitesi, Dumlupýnar Üniversitesi, Selçuk Üniversitesi, Adobe Photoshop,Nebim,Nebim V3,-, -, 54,
