Endoskopi Hemþiresi, 3.050, 2.200, 3.930,Hemþirelik ve Saðlýk Hizmetleri, Hemþirelik (MYO), Hemþirelik, Ýlk ve Acil (Paramedik), Saðlýk Kurumlarý Ýþletmeciliði, Saðlýk, Hizmet, Sigortacýlýk, Atýk Yönetimi ve Geri Dönüþüm, Topluluklar, Anadolu Üniversitesi, Marmara Üniversitesi, Ýstanbul Üniversitesi (ÝÜ), Atatürk Üniversitesi, Çanakkale 18 Mart Üniversitesi, Voleybol,Microsoft Office,Spor,Futbol,Çalýþkan,17,
Endüstri Mühendisi, 3.860, 2.020, 5.900,Endüstri Mühendisliði, Endüstri ve Sistem Mühendisliði, Makine Mühendisliði, Elektronik Teknolojisi, Endüstri Sistemleri Mühendisliði, Otomotiv, Üretim / Endüstriyel Ürünler, Tekstil, Maden ve Metal Sanayi, Yapý, Sakarya Üniversitesi, Eskiþehir Osmangazi Üniversitesi, Gazi Üniversitesi, Kocaeli Üniversitesi, Erciyes Üniversitesi, 5S,AutoCAD,C#,ERP,Ýþ ve süreç analizi,299,
Endüstriyel Otomasyon Teknikeri, 3.220, 2.400, 4.180,Endüstriyel Otomasyon (MYO), Endüstriyel Elektronik (MYO),  Kontrol ve Otomasyon Teknolojisi, Elektrik (MYO), Mekatronik (MYO), Elektrik & Elektronik, Enerji, Üretim / Endüstriyel Ürünler, Otomotiv, Yapý, Kocaeli Üniversitesi, Ege Üniversitesi, Dumlupýnar Üniversitesi, Anadolu Üniversitesi, Dokuz Eylül Üniversitesi, AutoCAD,Baský Devre Tasarýmý,Devre Tasarýmý,Elektrik Kumanda Panolarý,Elektrik Motorlarý,9,
Endüstriyel Psikolog, -, -, -, -, -, -, -, -, -, -, -, -, -, -, -, -, -, -, -, -, -, -, -, -,
Endüstriyel Tasarým Mühendisi, 5.180, 3.750, 6.760,-, -, -, -, -, -, -, -, -, -, -, -, -, -, -, -, -, -, -, -, 7,
Endüstriyel Tasarýmcý, 4.130, 2.020, 6.290,Endüstri Ürünleri Tasarýmý, Endüstriyel Tasarým, Makine Mühendisliði, Endüstriyel Tasarým Mühendisliði, Bilgisayar Destekli Tasarým (MYO), Üretim / Endüstriyel Ürünler, Mobilya & Aksesuar, Yapý, Reklam ve Tanýtým, Elektrik & Elektronik, Anadolu Üniversitesi, Orta Doðu Teknik Üniversitesi (ODTÜ), Ýstanbul Teknik Üniversitesi (ÝTÜ), Ýzmir Ekonomi Üniversitesi, Mimar Sinan Güzel Sanatlar Üniversitesi, 3D Max,3D Studio Max,3D Tasarým ve Modelleme Uygulamasý,Adobe After Effects,Adobe Illustrator,55,
Enerji Mühendisi, 4.430, 2.020, 7.440,Enerji Sistemleri Mühendisliði, Elektrik/Elektronik Mühendisliði, Makine Mühendisliði, Elektrik Mühendisliði, Endüstri Mühendisliði, Enerji, Yapý, Elektrik & Elektronik, Maden ve Metal Sanayi, Telekomünikasyon, Osmaniye Korkut Ata Üniversitesi, Süleyman Demirel Üniversitesi, Karabük Üniversitesi, Ýstanbul Teknik Üniversitesi (ÝTÜ), Fýrat Üniversitesi, AutoCAD,Bakým Planlama,C++,Elektrik Kumanda Panolarý,Elektrik Motorlarý,33,
Enerji Sistemleri Mühendisi, 4.190, 2.020, 6.880,Enerji Sistemleri Mühendisliði, Elektrik/Elektronik Mühendisliði, Elektrik (MYO), Doðalgaz - Isýtma ve Sýhhi Tesisat Teknolojisi (MYO), Makine Mühendisliði, Enerji, Elektrik & Elektronik, Yapý, Hizmet, Maden ve Metal Sanayi, Süleyman Demirel Üniversitesi, Karabük Üniversitesi, Fýrat Üniversitesi, Osmaniye Korkut Ata Üniversitesi, Yalova Üniversitesi , AutoCAD,C++,CATIA,HVAC,MATLAB,25,
Enerji Ticareti Uzmaný, 5.290, 2.500, 9.490,Endüstri Mühendisliði, Enerji Sistemleri Mühendisliði, Ýþletme, Ýstatistik, Elektrik/Elektronik Mühendisliði, Enerji, Elektrik & Elektronik, Yapý, Finans - Ekonomi, Üretim / Endüstriyel Ürünler, Ýhsan Doðramacý Bilkent Üniversitesi, Yýldýz Teknik Üniversitesi (YTÜ), Anadolu Üniversitesi, Bahçeþehir Üniversitesi, Ýstanbul Teknik Üniversitesi (ÝTÜ), Elektrik/Elektronik,Ýstatistiksel analiz,MATLAB,Pnömatik,SAP,13,
Enerji Uzman Yardýmcýsý, -, -, -, Elektrik/Elektronik Mühendisliði, Endüstri Mühendisliði, Ýþletme, Kamu Yönetimi, Uluslararasý Ýliþkiler, Enerji, Elektrik & Elektronik, Maden ve Metal Sanayi, Yapý, Hizmet, Orta Doðu Teknik Üniversitesi (ODTÜ), Anadolu Üniversitesi, Kahramanmaraþ Sütçü Ýmam Üniversitesi, Pamukkale Üniversitesi, Hacettepe Üniversitesi, Adobe Photoshop,AutoCAD,Güç elektroniði,ISIS PROTEUS / ARES,MATLAB,-,
Enerji Uzmaný, 3.820, 2.680, 5.030,Makine Mühendisliði, Elektrik/Elektronik Mühendisliði, Endüstri Mühendisliði, Ýþletme, Ýktisat, Enerji, Elektrik & Elektronik, Telekomünikasyon, Gýda, Yapý, Orta Doðu Teknik Üniversitesi (ODTÜ), Anadolu Üniversitesi, Yýldýz Teknik Üniversitesi (YTÜ), Hacettepe Üniversitesi, Gazi Üniversitesi, ArcGIS,AutoCAD,Elektrik Kumanda Panolarý,Elektrik Motorlarý,Elektrik/Elektronik,7,
Enerji Yöneticisi, 4.300, 2.960, 5.640,Elektrik/Elektronik Mühendisliði, Makine Mühendisliði, Elektrik Mühendisliði, Kimya Mühendisliði, Enerji Sistemleri Mühendisliði, Enerji, Tekstil, Otomotiv, Elektrik & Elektronik, Gýda, Orta Doðu Teknik Üniversitesi (ODTÜ), Yýldýz Teknik Üniversitesi (YTÜ), Kocaeli Üniversitesi, Ýstanbul Üniversitesi (ÝÜ), Gazi Üniversitesi, AutoCAD,Elektrik Kumanda Panolarý,Elektrik Motorlarý,Elektrik/Elektronik,Güç elektroniði,14,
Enfeksiyon Uzmaný, 11.040, 4.750, 21.330,-, -, -, -, -, -, -, -, -, -, -, -, -, -, -, -, -, -, -, -, 3,
Epidemiyoloji Doktoru, -, -, -, -, -, -, -, -, -, -, -, -, -, -, -, -, -, -, -, -, -, -, -, -,
Ergoterapist, 5.830, 4.500, 9.300,-, -, -, -, -, -, -, -, -, -, -, -, -, -, -, -, -, -, -, -, 3,
ERP Danýþmaný, 4.740, 2.030, 7.440,Endüstri Mühendisliði, Bilgisayar Mühendisliði, Ýþletme, MIS - Yönetim Biliþim Sistemleri, Bilgisayar Teknolojisi ve Programlama (MYO), Biliþim, Danýþmanlýk, Üretim / Endüstriyel Ürünler, Maden ve Metal Sanayi, Yapý, Sakarya Üniversitesi, Yýldýz Teknik Üniversitesi (YTÜ), Ýstanbul Teknik Üniversitesi (ÝTÜ), Ýstanbul Üniversitesi (ÝÜ), Kocaeli Üniversitesi, C#,CANIAS ERP,ERP,ERP - Kurumsal Kaynak Uygulamalarý,ERP Lojistik,65,
ERP Mühendisi, 5.110, 4.500, 5.960,Endüstri Mühendisliði, Bilgisayar Mühendisliði, Makine Mühendisliði, Matematik Mühendisliði, Endüstri Sistemleri Mühendisliði, Üretim / Endüstriyel Ürünler, Biliþim, Otomotiv, Yapý, Kimya, Sakarya Üniversitesi, Eskiþehir Osmangazi Üniversitesi, Gazi Üniversitesi, Marmara Üniversitesi, Yýldýz Teknik Üniversitesi (YTÜ), C#,C++,ERP,Java,MATLAB,6,
ERP Proje Yöneticisi, 6.480, 2.710, 10.240,Endüstri Mühendisliði, Bilgisayar Teknolojisi ve Programlama (MYO), Ýþletme, Bilgisayar Mühendisliði, Matematik Mühendisliði, Biliþim, Üretim / Endüstriyel Ürünler, Tekstil, Yapý, Elektrik & Elektronik, Yýldýz Teknik Üniversitesi (YTÜ), Anadolu Üniversitesi, Marmara Üniversitesi, Sakarya Üniversitesi, Ýstanbul Teknik Üniversitesi (ÝTÜ), C#,CANIAS ERP,ERP,ERP - Kurumsal Kaynak Uygulamalarý,ERP/MRP sistemleri,57,
ERP Sorumlusu, 4.090, 2.600, 5.800,Endüstri Mühendisliði, Bilgisayar Mühendisliði, Bilgisayar Teknolojisi ve Programlama (MYO), Ýktisat, Ýþletme, Üretim / Endüstriyel Ürünler, Elektrik & Elektronik, Biliþim, Tekstil, Yapý, Anadolu Üniversitesi, Sakarya Üniversitesi, Gazi Üniversitesi, Kocaeli Üniversitesi, Baþkent Üniversitesi, ASP.NET,AutoCAD,C,C#,CANIAS ERP,23,
ERP Uzmaný, 5.010, 3.340, 6.680,Endüstri Mühendisliði, Bilgisayar Teknolojisi ve Programlama (MYO), Bilgisayar Mühendisliði, Ýþletme, MIS - Yönetim Biliþim Sistemleri, Biliþim, Tekstil, Üretim / Endüstriyel Ürünler, Yapý, Perakende, Anadolu Üniversitesi, Sakarya Üniversitesi, Eskiþehir Osmangazi Üniversitesi, Ýstanbul Üniversitesi (ÝÜ), Ýstanbul Teknik Üniversitesi (ÝTÜ), ASP.NET,C#,CANIAS ERP,ERP,ERP - Kurumsal Kaynak Uygulamalarý,43,
E-sporcu, -, -, -, -, -, -, -, -, -, -, -, -, -, -, -, -, -, -, -, -, -, -, -, -,
Estetisyen, 2.660, 2.020, 3.350,Cilt Bakýmý ve Güzellik (MYO), Saç Bakýmý ve Güzellik Hizmetleri, Ýþletme, Týbbi ve Aromatik Bitkiler (MYO), Halkla Ýliþkiler, Saðlýk, Hizmet, Kimya, Turizm, Sigortacýlýk, Anadolu Üniversitesi, Ýstanbul Aydýn Üniversitesi, Adnan Menderes Üniversitesi, Ege Üniversitesi, Kocaeli Üniversitesi, Lazer uygulamalarý,Satýþ ve Pazarlama,Cilt Bakýmý,Estetisyen,Bilgisayar,145,
E-ticaret Danýþmaný, 3.550, 2.500, 4.650,Ýþletme, Bilgisayar Teknolojisi ve Programlama (MYO), Bilgisayar Programcýlýðý, Dýþ Ticaret (MYO), Uluslararasý Ýliþkiler, Ticaret, Tekstil, Biliþim, Telekomünikasyon, Maden ve Metal Sanayi, Anadolu Üniversitesi, Sakarya Üniversitesi, Marmara Üniversitesi, Beykent Üniversitesi, Kocaeli Üniversitesi, Adobe Dreamweaver,Adobe Flash,Adobe Illustrator,Adobe Photoshop,ASP.NET,11,
E-ticaret Direktörü, 4.600, 2.250, 7.780,Ýþletme, Bilgisayar Teknolojisi ve Programlama (MYO), Uluslararasý Ýliþkiler, Halkla Ýliþkiler ve Reklamcýlýk, Endüstri Mühendisliði, Ticaret, Tekstil, Biliþim, Perakende, Ev Eþyalarý, Anadolu Üniversitesi, Ýstanbul Üniversitesi (ÝÜ), Marmara Üniversitesi, Selçuk Üniversitesi, Uludað Üniversitesi, Adobe Flash,Adobe Illustrator,Adobe Photoshop,Apache HTTP Server,CSS,26,
E-Ticaret Kategori Yöneticisi, 4.670, 2.030, 7.310,Ýþletme, Ýktisat, Ýþletme (Ýngilizce), Bilgisayar Programcýlýðý, Uluslararasý Ýliþkiler, Ticaret, Biliþim, Perakende, Tekstil, Ev Eþyalarý, Anadolu Üniversitesi, Ýstanbul Üniversitesi (ÝÜ), Marmara Üniversitesi, Kocaeli Üniversitesi, Ýstanbul Kültür Üniversitesi, Adobe Photoshop,Dijital Pazarlama,E -ticaret,E-Ticaret,Google Adwords Kampanya Yönetimi,26,
E-ticaret Müdürü, 6.150, 2.790, 9.500,Ýþletme, Bilgisayar Teknolojisi ve Programlama (MYO), Bilgisayar Bilimleri, Ýktisat, Ýþletme (Ýngilizce), Ticaret, Tekstil, Biliþim, Perakende, Maden ve Metal Sanayi, Anadolu Üniversitesi, Ýstanbul Aydýn Üniversitesi, Trakya Üniversitesi, Ýstanbul Üniversitesi (ÝÜ), Marmara Üniversitesi, Adobe Photoshop,C#,CRM,Digital marketing,Dijital Pazarlama,50,
E-ticaret Raporlama Uzmaný, -, -, -, -, -, -, -, -, -, -, -, -, -, -, -, -, -, -, -, -, -, -, -, -,
E-ticaret Sorumlusu, 3.110, 2.200, 4.310,Ýþletme, Bilgisayar Teknolojisi ve Programlama (MYO), Bilgisayar Programcýlýðý, Ýktisat, Dýþ Ticaret (MYO), Ticaret, Tekstil, Biliþim, Ev Eþyalarý, Perakende, Anadolu Üniversitesi, Ýstanbul Üniversitesi (ÝÜ), Kocaeli Üniversitesi, Marmara Üniversitesi, Sakarya Üniversitesi, Adobe Dreamweaver,Adobe Illustrator,Adobe Photoshop,C#,CSS,58,
E-ticaret Uzmaný, 3.420, 2.160, 4.670,Ýþletme, Bilgisayar Teknolojisi ve Programlama (MYO), Ýktisat, Bilgisayar Programcýlýðý, Dýþ Ticaret (MYO), Ticaret, Tekstil, Biliþim, Perakende, Ev Eþyalarý, Anadolu Üniversitesi, Ýstanbul Üniversitesi (ÝÜ), Marmara Üniversitesi, Selçuk Üniversitesi, Kocaeli Üniversitesi, Adobe Illustrator,Adobe Photoshop,CSS,Dijital Pazarlama,E Ticaret,58,
E-ticaret Yöneticisi, 4.600, 2.680, 6.520,Ýþletme, Bilgisayar Teknolojisi ve Programlama (MYO), Bilgisayar Programcýlýðý, Bilgisayar Mühendisliði, Ýktisat, Ticaret, Tekstil, Biliþim, Perakende, Ev Eþyalarý, Anadolu Üniversitesi, Marmara Üniversitesi, Sakarya Üniversitesi, Ýstanbul Üniversitesi (ÝÜ), Çanakkale 18 Mart Üniversitesi, Adobe Dreamweaver,Adobe Illustrator,Adobe Photoshop,CSS,Dijital Pazarlama,34,
Etkinlik Koordinatörü, 5.090, 3.000, 7.690,Ýþletme, Turizm Ýþletmeciliði, Turizm ve Otel Ýþletmeciliði (MYO), Uluslararasý Ýliþkiler, Ýþletme (Ýngilizce), Eðlence - Kültür - Sanat, Turizm, Reklam ve Tanýtým, Eðitim, Hizmet, Ýstanbul Üniversitesi (ÝÜ), Anadolu Üniversitesi, Ýhsan Doðramacý Bilkent Üniversitesi, Ýstanbul Bilgi Üniversitesi, Marmara Üniversitesi, Adobe Photoshop,AutoCAD,Bütçe planlama ve raporlama,Finansal Raporlama,Pazarlama Stratejisi,14,
Etkinlik Uzmaný, 4.450, 2.570, 6.760,Ýþletme, Sosyoloji, Uluslararasý Ýliþkiler, Ekonomi, Ýþletme (Ýngilizce), Eðitim, Saðlýk, Hizmet, Reklam ve Tanýtým, Eðlence - Kültür - Sanat, Ýstanbul Üniversitesi (ÝÜ), Anadolu Üniversitesi, Yeditepe Üniversitesi, Marmara Üniversitesi, Boðaziçi Üniversitesi, Mac OS,Müþteri Hizmetleri Operasyon Yönetimi,Planlama Ve Organizasyon,Proje Yönetimi,Sosyal Medya Yönetimi,13,
Etkinlik ve Organizasyon Sorumlusu, 4.060, 2.710, 5.400,Ýþletme, Ýktisat, Halkla Ýliþkiler ve Tanýtým, Uluslararasý Ýliþkiler, Turizm ve Otel Ýþletmeciliði (MYO), Reklam ve Tanýtým, Eðlence - Kültür - Sanat, Turizm, Hizmet, Eðitim, Anadolu Üniversitesi, Ýstanbul Üniversitesi (ÝÜ), Kocaeli Üniversitesi, Marmara Üniversitesi, Ýstanbul Bilgi Üniversitesi, Adobe Illustrator,Adobe Photoshop,Planlama Ve Organizasyon,Sosyal Medya Yönetimi,-, 11,
Etkinlik Yöneticisi, 5.190, 2.950, 7.710,Ýþletme, Uluslararasý Ýliþkiler, Halkla Ýliþkiler ve Tanýtým, Turizm - Otelcilik, Sahne ve Gösteri Sanatlarý Yönetimi, Reklam ve Tanýtým, Eðlence - Kültür - Sanat, Turizm, Danýþmanlýk, Hizmet, Ýstanbul Üniversitesi (ÝÜ), Anadolu Üniversitesi, Marmara Üniversitesi, Ýstanbul Bilgi Üniversitesi, Kocaeli Üniversitesi, Adobe Illustrator,Adobe Photoshop,AutoCAD,Pazarlama Stratejisi,Proje Yönetimi,15,
Etüt Öðretmeni, -, -, -, Matematik, Türk Dili ve Edebiyatý, Fen Bilgisi Öðretmenliði, Tarih, Biyoloji, Eðitim, Danýþmanlýk, Tekstil, Hizmet, Turizm, Anadolu Üniversitesi, Gazi Üniversitesi, Hacettepe Üniversitesi, Ýstanbul Üniversitesi (ÝÜ), Ankara Üniversitesi, Adobe Photoshop,MATLAB,-, -, -, -,
Evde Bakým Hemþiresi, 4.650, 2.400, 7.470,Evde Hasta Bakýmý Bölümü, Yaþlý Hizmetleri Bakýmý (MYO), Hemþirelik ve Saðlýk Hizmetleri, Hemþirelik (MYO), Hemþirelik, Saðlýk, Hizmet, Sigortacýlýk, Eðitim, Ticaret, Adnan Menderes Üniversitesi, Anadolu Üniversitesi, Kastamonu Üniversitesi, Ýstanbul Üniversitesi (ÝÜ), Bartýn Üniversitesi, Hasta Bakýmý,Ýþçi Saðlýðý ve Ýþ Güvenliði,-, -, -, 5,
Expat, -, -, -, -, -, -, -, -, -, -, -, -, -, -, -, -, -, -, -, -, -, -, -, -,
Fabrika Müdürü, 9.410, 4.690, 14.140,Makine Mühendisliði, Endüstri Mühendisliði, Kimya Mühendisliði, Gýda Mühendisliði, Ýþletme, Gýda, Üretim / Endüstriyel Ürünler, Maden ve Metal Sanayi, Kimya, Tekstil, Ýstanbul Teknik Üniversitesi (ÝTÜ), Anadolu Üniversitesi, Yýldýz Teknik Üniversitesi (YTÜ), Orta Doðu Teknik Üniversitesi (ODTÜ), Ege Üniversitesi, Fiyat Analizleri,ISO 14000,ISO 14001,ISO 16949,ISO 9001:2000,265,
Farmakovijilans Sorumlusu, 3.980, 3.000, 5.360,Eczacýlýk, Veteriner, Endüstri Mühendisliði, Ziraat Mühendisliði, Biyoloji, Saðlýk, Üretim / Endüstriyel Ürünler, Hayvancýlýk, Tekstil, Danýþmanlýk, Ýstanbul Üniversitesi (ÝÜ), Marmara Üniversitesi, Ankara Üniversitesi, Anadolu Üniversitesi, Hacettepe Üniversitesi, Adobe Photoshop,-, -, -, -, 4,
Farsça Öðretmeni, -, -, -, -, -, -, -, -, -, -, -, -, -, -, -, -, -, -, -, -, -, -, -, -,
Fason Takip Elemaný, 4.340, 3.000, 5.730,Ýþletme, Tekstil (MYO), Moda Tasarýmý (MYO), Sosyoloji, Dýþ Ticaret ve Avrupa Birliði (MYO), Tekstil, Ticaret, Ev Eþyalarý, Basým - Yayýn, Üretim / Endüstriyel Ürünler, Anadolu Üniversitesi, Trakya Üniversitesi, Ýstanbul Üniversitesi (ÝÜ), Ýstanbul Aydýn Üniversitesi, Uludað Üniversitesi, Adobe Photoshop,Dikim,Kalite / AR-GE,SPSS,Src 2,33,
Fason Takip Sorumlusu, 4.080, 2.850, 5.310,Ýþletme, Tekstil (MYO), Ýktisat, Kamu Yönetimi, Kimya, Tekstil, Ev Eþyalarý, Ticaret, Üretim / Endüstriyel Ürünler, Kimya, Anadolu Üniversitesi, Uludað Üniversitesi, Sakarya Üniversitesi, Pamukkale Üniversitesi, Atatürk Üniversitesi, Dikim,Planlama Ve Organizasyon,Satýþ Yönetimi,SRC4,TEKSTÝL,25,
Fayans Ustasý, 4.690, 3.000, 7.110,Bankacýlýk ve Sigortacýlýk, Ýktisat, Coðrafya, Yapý, Otomotiv, -, -, -, -, -, -, -, -, -, -, Boya,Kaba Ýnþaat,Üst Yapý Ýnþaatlarý,-, -, 10,
Felsefe Grubu Öðretmeni, 2.610, 2.020, 3.190,Sosyoloji, Felsefe, Felsefe Grubu Öðretmenliði, Sosyal Hizmetler, Psikoloji, Eðitim, Danýþmanlýk, Hizmet, Tekstil, Gýda, Sakarya Üniversitesi, Anadolu Üniversitesi, Ýstanbul Üniversitesi (ÝÜ), Pamukkale Üniversitesi, Süleyman Demirel Üniversitesi, SPSS,-, -, -, -, 29,
Felsefe Öðretmeni, 2.480, 2.070, 2.890,Felsefe, Sosyoloji, Felsefe Grubu Öðretmenliði, Halkla Ýliþkiler, Eðitim Bilimleri, Eðitim, Danýþmanlýk, Tekstil, Hizmet, Reklam ve Tanýtým, Sakarya Üniversitesi, Anadolu Üniversitesi, Ýstanbul Üniversitesi (ÝÜ), Uludað Üniversitesi, Kýrklareli Üniversitesi, Ýnsan Kaynaklarý,SPSS,-, -, -, 12,
Fen Bilgisi Öðretmeni, 3.070, 2.090, 4.060,Fen Bilgisi Öðretmenliði, Biyoloji, Fizik, Kimya, Fizik Öðretmenliði, Eðitim, Danýþmanlýk, Saðlýk, Hizmet, Tekstil, Gazi Üniversitesi, Ondokuz Mayýs Üniversitesi, Manisa Celal Bayar Üniversitesi, Karadeniz Teknik Üniversitesi (KTÜ), Atatürk Üniversitesi, Adobe Photoshop,Proje Yönetimi,-, -, -, 206,
Fen Ýþleri Müdürü, 6.330, 5.500, 8.500,Ýnþaat Mühendisliði, Harita Kadastro (MYO), Mimarlýk, Ýnþaat (MYO), Çevre Mühendisliði, Yapý, Hizmet, Elektrik & Elektronik, Üretim / Endüstriyel Ürünler, Gýda, Karadeniz Teknik Üniversitesi (KTÜ), Yýldýz Teknik Üniversitesi (YTÜ), Çukurova Üniversitesi, Ýstanbul Teknik Üniversitesi (ÝTÜ), Harran Üniversitesi, ArcGIS,AutoCAD,Autodesk 3Ds Max,Autodesk Revit,C++,3,
Fen ve Teknoloji Öðretmeni, 3.140, 2.500, 3.990,Fen Bilgisi Öðretmenliði, Fizik, Biyoloji, Kimya, Fizik Öðretmenliði, Eðitim, Danýþmanlýk, Hizmet, Saðlýk, Basým - Yayýn, Gazi Üniversitesi, Ondokuz Mayýs Üniversitesi, Ýstanbul Üniversitesi (ÝÜ), Marmara Üniversitesi, Atatürk Üniversitesi, Ticaret,Bilgisayar,Microsoft Office,Müzik,	Deadline And Target Driven,9,
Ferforje Ustasý, -, -, -, -, -, -, -, -, -, -, -, -, -, -, -, -, -, -, -, -, -, -, -, -,
Figüran, -, -, -, Ýktisat, Elektrik/Elektronik Mühendisliði, Radyo - Sinema ve Televizyon, Ýþletme Yönetimi, Radyo ve Televizyon, Eðlence - Kültür - Sanat, Reklam ve Tanýtým, Medya, Hizmet, Eðitim, Anadolu Üniversitesi, Kocaeli Üniversitesi, Ýstanbul Üniversitesi (ÝÜ), Akdeniz Üniversitesi, Ýstanbul Geliþim Üniversitesi, Adobe Photoshop,MATLAB,-, -, -, -,
Finans Danýþmaný, 3.720, 2.020, 5.800,Ýþletme, Ýktisat, Bankacýlýk ve Sigortacýlýk (MYO), Kamu Yönetimi, Maliye, Sigortacýlýk, Finans - Ekonomi, Danýþmanlýk, Yapý, Hizmet, Anadolu Üniversitesi, Ýstanbul Üniversitesi (ÝÜ), Marmara Üniversitesi, Uludað Üniversitesi, Gazi Üniversitesi, Bankacýlýk/Finans,Bütçe planlama ve raporlama,Cari Hesap ve Finans Takibi,Dýþ Ticaret,Finans,59,
Finans Direktörü, 10.930, 5.740, 16.120,Ýþletme, Ýktisat, Ýþletme (Ýngilizce), Ekonomi, Ýktisat (Ýngilizce), Yapý, Turizm, Enerji, Saðlýk, Biliþim, Ýstanbul Üniversitesi (ÝÜ), Marmara Üniversitesi, Anadolu Üniversitesi, Orta Doðu Teknik Üniversitesi (ODTÜ), Boðaziçi Üniversitesi, Bilanço analizi,Bütçe planlama ve raporlama,Cari Hesap ve Finans Takibi,Finans,Finansal Analiz,152,
Finans Genel Müdür Yardýmcýsý, 6.900, 4.000, 12.620,Ýþletme, Ýktisat, Ekonomi, Maliye, Ýþletme (Ýngilizce), Yapý, Taþýmacýlýk, Enerji, Tekstil, Finans - Ekonomi, Marmara Üniversitesi, Anadolu Üniversitesi, Ýstanbul Üniversitesi (ÝÜ), Boðaziçi Üniversitesi, Dokuz Eylül Üniversitesi, Bankacýlýk/Finans,Bütçe planlama ve raporlama,Finans,Finansal planlama/kontrol,Finansal Raporlama,16,
Finans Koordinatörü, 6.650, 3.000, 10.430,Ýþletme, Ýktisat, Ekonomi, Ýþletme (Ýngilizce), Maliye, Yapý, Gýda, Hizmet, Finans - Ekonomi, Enerji, Anadolu Üniversitesi, Ýstanbul Üniversitesi (ÝÜ), Dokuz Eylül Üniversitesi, Gazi Üniversitesi, Uludað Üniversitesi, Bankacýlýk/Finans,Bilanço analizi,Bütçe planlama ve raporlama,Cari Hesap ve Finans Takibi,Finans,19,
Finans Müdürü, 7.980, 3.270, 12.690,Ýþletme, Ýktisat, Ýþletme (Ýngilizce), Maliye, Ýktisat (Ýngilizce), Yapý, Gýda, Tekstil, Otomotiv, Maden ve Metal Sanayi, Anadolu Üniversitesi, Ýstanbul Üniversitesi (ÝÜ), Marmara Üniversitesi, Dokuz Eylül Üniversitesi, Uludað Üniversitesi, Bilanço analizi,Bireysel Krediler,Bütçe planlama ve raporlama,Cari Hesap Ýþlemleri,Cari Hesap ve Finans Takibi,331,
Finans Sorumlusu, 3.910, 2.240, 5.590,Ýþletme, Ýktisat, Muhasebe (MYO), Muhasebe, Maliye, Yapý, Otomotiv, Gýda, Tekstil, Hizmet, Anadolu Üniversitesi, Ýstanbul Üniversitesi (ÝÜ), Uludað Üniversitesi, Dumlupýnar Üniversitesi, Marmara Üniversitesi, Bankacýlýk/Finans,Bütçe planlama ve raporlama,Cari Hesap Ýþlemleri,Cari Hesap ve Finans Takibi,Çek-senet mevzuatý,270,
Finans Uzmaný, 4.050, 2.480, 5.620,Ýþletme, Ýktisat, Muhasebe (MYO), Maliye, Muhasebe, Yapý, Finans - Ekonomi, Otomotiv, Enerji, Gýda, Anadolu Üniversitesi, Ýstanbul Üniversitesi (ÝÜ), Marmara Üniversitesi, Uludað Üniversitesi, Kocaeli Üniversitesi, Bankacýlýk/Finans,Cari Hesap Ýþlemleri,Cari Hesap ve Finans Takibi,Çek-senet mevzuatý,Finans,344,
Finans Yöneticisi / Yönetmeni, 5.950, 3.290, 8.610,Ýþletme, Ýktisat, Maliye, Ýþletme (Ýngilizce), Muhasebe (MYO), Yapý, Finans - Ekonomi, Gýda, Tekstil, Taþýmacýlýk, Anadolu Üniversitesi, Ýstanbul Üniversitesi (ÝÜ), Marmara Üniversitesi, Uludað Üniversitesi, Dokuz Eylül Üniversitesi, Bilanço analizi,Bütçe planlama ve raporlama,Cari Hesap Ýþlemleri,Cari Hesap ve Finans Takibi,Çek-senet mevzuatý,54,
Finansal Analist, 6.340, 2.540, 10.150,Ýþletme, Ýktisat, Ýþletme (Ýngilizce), Ýktisat (Ýngilizce), Ekonomi, Finans - Ekonomi, Danýþmanlýk, Saðlýk, Hýzlý Tüketim Mallarý, Otomotiv, Ýstanbul Üniversitesi (ÝÜ), Marmara Üniversitesi, Boðaziçi Üniversitesi, Orta Doðu Teknik Üniversitesi (ODTÜ), Dokuz Eylül Üniversitesi, Bankacýlýk/Finans,Bütçe planlama ve raporlama,Finans,Finansal Analiz,Finansal planlama/kontrol,43,
Finansal Danýþman, 3.700, 2.020, 6.250,Ýþletme, Ýktisat, Bankacýlýk ve Sigortacýlýk (MYO), Bankacýlýk ve Sigortacýlýk, Kamu Yönetimi, Sigortacýlýk, Finans - Ekonomi, Danýþmanlýk, Hizmet, Saðlýk, Anadolu Üniversitesi, Kocaeli Üniversitesi, Manisa Celal Bayar Üniversitesi, Selçuk Üniversitesi, Süleyman Demirel Üniversitesi, Bankacýlýk/Finans,Cari Hesap ve Finans Takibi,Finans,Finansal Analiz,Finansal planlama/kontrol,26,
Finansal Güvence Danýþmaný, 3.380, 2.060, 4.690,Ýþletme, Ýktisat, Bankacýlýk ve Sigortacýlýk (MYO), Bankacýlýk ve Sigortacýlýk, Kamu Yönetimi, Sigortacýlýk, Danýþmanlýk, Finans - Ekonomi, Hizmet, Tekstil, Anadolu Üniversitesi, Dumlupýnar Üniversitesi, Süleyman Demirel Üniversitesi, Selçuk Üniversitesi, Akdeniz Üniversitesi, Finansal Analiz,Finansal planlama/kontrol,Finansal Risk Yönetimi,Ýnsan Kaynaklarý Yönetimi,Muhasebe,26,
Finansal Kontrolör, 8.100, 3.560, 12.650,Ýþletme, Ýþletme (Ýngilizce), Ýktisat, Ýktisat (Ýngilizce), Ekonomi, Otomotiv, Finans - Ekonomi, Yapý, Gýda, Telekomünikasyon, Ýstanbul Üniversitesi (ÝÜ), Marmara Üniversitesi, Anadolu Üniversitesi, Orta Doðu Teknik Üniversitesi (ODTÜ), Dokuz Eylül Üniversitesi, Bütçe planlama ve raporlama,Cari Hesap ve Finans Takibi,Finans,Finansal Analiz,Finansal planlama/kontrol,82,
Finansal Planlama Uzmaný, 11.150, 8.270, 14.950,Endüstri Mühendisliði, Ekonomi, Ýþletme, Ekonometri, Ýktisat (Ýngilizce), Finans - Ekonomi, Enerji, Hýzlý Tüketim Mallarý, Sigortacýlýk, Gýda, Ýstanbul Üniversitesi (ÝÜ), Marmara Üniversitesi, Ýstanbul Teknik Üniversitesi (ÝTÜ), Orta Doðu Teknik Üniversitesi (ODTÜ), Kocaeli Üniversitesi, Bankacýlýk/Finans,Bütçe planlama ve raporlama,Finansal Analiz,Finansal planlama/kontrol,Finansal Raporlama,3,
Finansal Raporlama Uzmaný, 6.730, 3.620, 9.830,Ýþletme, Ýktisat, Ýþletme (Ýngilizce), Ýktisat (Ýngilizce), Ekonomi, Finans - Ekonomi, Hizmet, Topluluklar, Yapý, Enerji, Ýstanbul Üniversitesi (ÝÜ), Marmara Üniversitesi, Ýhsan Doðramacý Bilkent Üniversitesi, Dokuz Eylül Üniversitesi, Anadolu Üniversitesi, Bütçe planlama ve raporlama,Finans,Finansal Analiz,Finansal planlama/kontrol,Finansal Raporlama,34,
Finansman Müdürü, 7.090, 3.500, 10.680,Ýþletme, Ýktisat, Maliye, Kamu Yönetimi, Ekonomi, Yapý, Tekstil, Maden ve Metal Sanayi, Gýda, Otomotiv, Anadolu Üniversitesi, Dokuz Eylül Üniversitesi, Ýstanbul Üniversitesi (ÝÜ), Marmara Üniversitesi, Gazi Üniversitesi, Bilanço analizi,Bütçe planlama ve raporlama,Cari Hesap Ýþlemleri,Cari Hesap ve Finans Takibi,Çek-senet mevzuatý,12,
Fitness Eðitmeni, 3.070, 2.020, 4.320,Antrenörlük Eðitimi, Beden Eðitimi ve Spor Öðretmenliði, Spor Yöneticiliði, Rekreasyon Yönetimi, Ýþletme, Turizm, Eðitim, Saðlýk, Hizmet, Eðlence - Kültür - Sanat, Anadolu Üniversitesi, Marmara Üniversitesi, Kocaeli Üniversitesi, Haliç Üniversitesi, Ýstanbul Üniversitesi (ÝÜ), Spor,Futbol,Yüzme,Basketbol,Fitness,56,
Fitopatoloji Teknikeri, -, -, -, -, -, -, -, -, -, -, -, -, -, -, -, -, -, -, -, -, -, -, -, -,
Fiyatlandýrma Analisti, 4.930, 3.000, 7.250,Endüstri Mühendisliði, Ýþletme, Turizm Ýþletmeciliði, Kimya Mühendisliði, Ýktisat (Ýngilizce), Turizm, Sigortacýlýk, Taþýmacýlýk, Saðlýk, Enerji, Ýstanbul Teknik Üniversitesi (ÝTÜ), Beykent Üniversitesi, Kocaeli Üniversitesi, Mustafa Kemal Üniversitesi, Yeditepe Üniversitesi, Attention To Detail,C#,CRM,Depo Ve Lojistik Yönetimi,Ýþ ve süreç analizi,9,
Fiyatlandýrma Uzmaný, 4.350, 2.500, 6.580,Endüstri Mühendisliði, Ýþletme, Ýktisat, Ýstatistik, Ýktisat (Ýngilizce), Taþýmacýlýk, Saðlýk, Turizm, Otomotiv, Telekomünikasyon, Anadolu Üniversitesi, Marmara Üniversitesi, Ýstanbul Üniversitesi (ÝÜ), Dokuz Eylül Üniversitesi, Yýldýz Teknik Üniversitesi (YTÜ), Bütçe planlama ve raporlama,Bütçeleme Analizleri,Fiyat Analizleri,Ýþ ve süreç analizi,Pazarlama Stratejisi,34,
Fiyatlandýrma ve Kampanya Uzmaný, -, -, -, -, -, -, -, -, -, -, -, -, -, -, -, -, -, -, -, -, -, -, -, -,
