job_name, mean_salary, max_salary, min_salary, first_grad, second_grad, third_grad, fourth_grad, fiveth_grad, first_department, second_department, third_department, fourth_department, fiveth_department, first_school, second_school, third_school, fourth_school, fiveth_school, first_skill, second_skill, third_skill, fourth_skill, fiveth_skill, number_of_entries 
A Sýnýfý Ýþ Güvenliði Uzmaný, 4.950, 2.030, 7.870,Maden Mühendisliði, Makine Mühendisliði, Kimya, Jeoloji Mühendisliði, Çevre Mühendisliði, Çevre, Saðlýk, Yapý, Hizmet, Güvenlik, Hacettepe Üniversitesi, Ýstanbul Teknik Üniversitesi (ÝTÜ), Ege Üniversitesi, Ýstanbul Üniversitesi (ÝÜ), Çukurova Üniversitesi, AutoCAD,GSM,ISO 14001,ISO 9001,ISO 9001:2000,304,
AB Proje Asistaný, 4.110, 2.250, 7.380,Uluslararasý Ýliþkiler, Ýþletme, Siyaset Bilimi ve Kamu Yönetimi, Biyoloji, Sosyoloji, Danýþmanlýk, Eðitim, Yapý, Topluluklar, Hizmet, Hacettepe Üniversitesi, Anadolu Üniversitesi, Orta Doðu Teknik Üniversitesi (ODTÜ), Ýhsan Doðramacý Bilkent Üniversitesi, Ege Üniversitesi, Adobe Photoshop,Ansys Workbench,AutoCAD,C#,C++,27,
AB Proje Geliþtirme Uzmaný, 5.650, 3.500, 9.440,Uluslararasý Ýliþkiler, Makine-Resim-Konstrüksiyon (MYO), Ýþletme, Çalýþma Ekonomisi ve Endüstri Ýliþkileri, Ýktisat, Danýþmanlýk, Yapý, Eðitim, Maden ve Metal Sanayi, Taþýmacýlýk, Karadeniz Teknik Üniversitesi (KTÜ), Anadolu Üniversitesi, Ankara Üniversitesi, Ege Üniversitesi, Orta Doðu Teknik Üniversitesi (ODTÜ), APQP,AutoCAD,ISO 9001:2000,Ýhracat iþlemleri,Maliyet Analizleri,9,
Acente Temsilcisi, 3.610, 2.020, 6.160,Ýþletme, Turizm ve Seyahat Ýþletmeciliði (MYO), Seyahat Ýþletmeciliði, Turizm ve Otel Ýþletmeciliði (MYO), Seyahat Ýþletmeciliði ve Turizm Rehberliði, Turizm, Sigortacýlýk, Taþýmacýlýk, Hizmet, Finans - Ekonomi, Anadolu Üniversitesi, Muðla Üniversitesi, Çanakkale 18 Mart Üniversitesi, Adnan Menderes Üniversitesi, Balýkesir Üniversitesi, Maliyet Muhasebesi,Satýþ Yönetimi,-, -, -, 29,
Acil Servis Hemþiresi, 2.700, 2.020, 3.430,Ýlk ve Acil (Paramedik), Hemþirelik, Hemþirelik ve Saðlýk Hizmetleri, Hemþirelik (MYO), Acil Yardým Teknikerliði (MYO), Saðlýk, Hizmet, Sigortacýlýk, Biliþim, Eðitim, Anadolu Üniversitesi, Üsküdar Üniversitesi , Ýstanbul Medipol Üniversitesi , Marmara Üniversitesi, Sakarya Üniversitesi, Ýþçi Saðlýðý ve Ýþ Güvenliði,Kan Alma,-, -, -, 96,
Acil Týp Teknisyeni, 2.570, 2.020, 3.170,Ýlk ve Acil (Paramedik), Acil Yardým Teknikerliði (MYO), Acil Yardým ve Afet Yönetimi, Saðlýk Kurumlarý Ýþletmeciliði, Ýþ Saðlýðý ve Güvenliði (MYO), Saðlýk, Hizmet, Sigortacýlýk, Çevre, Yapý, Anadolu Üniversitesi, Atatürk Üniversitesi, Üsküdar Üniversitesi , Ýstanbul Medipol Üniversitesi , Kocaeli Üniversitesi, Ýþçi Saðlýðý ve Ýþ Güvenliði,-, -, -, -, 116,
Acil Týp Uzmaný, 12.300, 8.000, 18.040,Týp, Acil Yardým ve Afet Yönetimi, Saðlýk Kurumlarý Ýþletmeciliði, Taký Tasarýmý, Adalet (MYO), Saðlýk, Hizmet, Çevre, Sigortacýlýk, Biliþim, Ondokuz Mayýs Üniversitesi, Uludað Üniversitesi, Ýstanbul Üniversitesi (ÝÜ), Gülhane Askeri Týp Akademisi, Ege Üniversitesi, SPSS,-, -, -, -, 18,
Adli Týp Uzmaný, 10.500, 4.500, 22.980,-, -, -, -, -, -, -, -, -, -, -, -, -, -, -, -, -, -, -, -, 3,
Aerodinamik Mühendisi, 6.400, 3.350, 9.460,Makine Mühendisliði, Uçak Mühendisliði, Uzay Mühendisliði, Havacýlýk ve Uzay Mühendisliði, Gemi Ýnþaatý ve Gemi Makineleri Mühendisliði, Üretim / Endüstriyel Ürünler, Havacýlýk, Hizmet, Enerji, Otomotiv, Ýstanbul Teknik Üniversitesi (ÝTÜ), Orta Doðu Teknik Üniversitesi (ODTÜ), Manisa Celal Bayar Üniversitesi, TOBB Ekonomi ve Tek. Üniversitesi, Yýldýz Teknik Üniversitesi (YTÜ), ABAQUS,Ansys Fluent,Ansys Workbench,AutoCAD,CATIA,23,
Að Geliþtirme Müdürü, 7.530, 3.000, 12.680,-, -, -, -, -, -, -, -, -, -, -, -, -, -, -, -, -, -, -, -, 8,
Að Kurulum Mühendisi, 4.580, 2.370, 6.940,Bilgisayar Mühendisliði, Elektronik ve Haberleþme Müh., Elektrik/Elektronik Mühendisliði, Bilgisayar Sistem ve Aðlarý, Ýþletme, Biliþim, Telekomünikasyon, Hizmet, Gýda, Turizm, Süleyman Demirel Üniversitesi, Yýldýz Teknik Üniversitesi (YTÜ), Anadolu Üniversitesi, Çukurova Üniversitesi, Ankara Üniversitesi, C#,C++,Cisco Routers,Delphi,Görüntü Ýþlemleme,15,
Að Mimarý, -, -, -, Mimarlýk, Elektrik/Elektronik Mühendisliði, Elektronik Mühendisliði, Elektronik ve Haberleþme Müh., Ýnþaat Teknolojisi, Yapý, Telekomünikasyon, Biliþim, Hizmet, Kimya, Ýstanbul Teknik Üniversitesi (ÝTÜ), Sakarya Üniversitesi, Anadolu Üniversitesi, Ýstanbul Üniversitesi (ÝÜ), Maltepe Üniversitesi, 3D Max,Adobe Photoshop,AutoCAD,Bilanço analizi,Bilgisayar Destekli Tasarým Araçlarý,-,
Að Sistemleri Destek Mühendisi, 4.220, 2.500, 6.400,Elektronik ve Haberleþme Müh., Elektrik/Elektronik Mühendisliði, Bilgisayar Mühendisliði, Elektronik Haberleþme (MYO), Biliþim Sistemleri Mühendisliði, Biliþim, Telekomünikasyon, Hizmet, Elektrik & Elektronik, Finans - Ekonomi, Süleyman Demirel Üniversitesi, Kocaeli Üniversitesi, Namýk Kemal Üniversitesi, Ýstanbul Üniversitesi (ÝÜ), Yýldýz Teknik Üniversitesi (YTÜ), C#,C++,Cisco Routers,DHCP,IP,9,
Að ve Siber Güvenlik Uzmaný, 5.770, 2.500, 9.100,Bilgisayar Mühendisliði, Elektrik/Elektronik Mühendisliði, Elektronik ve Haberleþme Müh., Bilgisayar Teknolojisi ve Programlama (MYO), Ýþletme, Biliþim, Güvenlik, Telekomünikasyon, Hizmet, Finans - Ekonomi, Orta Doðu Teknik Üniversitesi (ODTÜ), Anadolu Üniversitesi, Süleyman Demirel Üniversitesi, Kocaeli Üniversitesi, Sakarya Üniversitesi, C,C#,C++,Cisco Routers,DHCP,59,
Að Yöneticisi, 5.750, 2.500, 9.050,Ýþletme, Ýktisat, Kamu Yönetimi, Elektrik/Elektronik Mühendisliði, Bilgisayar Mühendisliði, Biliþim, Yapý, Eðitim, Hizmet, Gýda, Anadolu Üniversitesi, Ýstanbul Üniversitesi (ÝÜ), Erciyes Üniversitesi, Uludað Üniversitesi, Ýstanbul Teknik Üniversitesi (ÝTÜ), Cisco Routers,Ýnsan Kaynaklarý Yönetimi,LAN (Local Area Network),Linux,Sosyal Medya Yönetimi,13,
Aðaç Ýþleri Endüstri Mühendisi, -, -, -, -, -, -, -, -, -, -, -, -, -, -, -, -, -, -, -, -, -, -, -, -,
Aðaç Ýþleri Mühendisi, -, -, -, -, -, -, -, -, -, -, -, -, -, -, -, -, -, -, -, -, -, -, -, -,
Aðaç Ýþleri Teknikeri, -, -, -, Mobilya ve Dekorasyon (MYO), Aðaç Ýþleri (MYO), Ormancýlýk (MYO), Ýþletme, Ýç Mekan Tasarýmý, Mobilya & Aksesuar, Orman Ürünleri, Yapý, Ofis / Büro Malzemeleri, Tarým / Ziraat, Çanakkale 18 Mart Üniversitesi, Gaziosmanpaþa Üniversitesi, Bartýn Üniversitesi, Afyon Kocatepe Üniversitesi, Ýstanbul Üniversitesi (ÝÜ), Adobe Fireworks,Ansys Workbench,AutoCAD,Autodesk,Autodesk Inventor,-,
Aðýr Vasýta Þoförü, 3.180, 2.100, 4.250,Ýþletme, Kamu Yönetimi, Otomotiv (MYO), Muhasebe, Makine (MYO), Taþýmacýlýk, Yapý, Gýda, Hizmet, Maden ve Metal Sanayi, Anadolu Üniversitesi, Atatürk Üniversitesi, Kocaeli Üniversitesi, Süleyman Demirel Üniversitesi, Abant Ýzzet Baysal Üniversitesi, Forklift Operatörü,Psikoteknik,Src 2,Src 4,SRC4,261,
Ahþap Doðrama Ustasý, -, -, -, Mobilya ve Dekorasyon (MYO), Ormancýlýk (MYO), Ýþletme, Görsel Sanatlar ve Görsel Ýletiþim Tasarýmý, Halkla Ýliþkiler ve Tanýtým (MYO), Mobilya & Aksesuar, Orman Ürünleri, Yapý, Biliþim, Üretim / Endüstriyel Ürünler, Çukurova Üniversitesi, Akdeniz Üniversitesi, Gaziosmanpaþa Üniversitesi, Nevþehir Üniversitesi, Ýskenderun Teknik Üniversitesi, Elektrik,Elektronik,Makine Teknikeri,MOBÝLYA MONTAJ,Müþteri Hizmetleri Operasyon Yönetimi,-,
Ahþap Ustasý, 6.420, 3.000, 11.050,Mobilya ve Dekorasyon (MYO), Ýþletme, Ýnþaat (MYO), Ýktisat, Mobilya ve Ýç Mekan Tasarýmý, Mobilya & Aksesuar, Yapý, Orman Ürünleri, Üretim / Endüstriyel Ürünler, Ofis / Büro Malzemeleri, Anadolu Üniversitesi, Selçuk Üniversitesi, Kahramanmaraþ Sütçü Ýmam Üniversitesi, Sakarya Üniversitesi, Pamukkale Üniversitesi, Adobe Photoshop,Cnc Torna,Üst Yapý Ýnþaatlarý,-, -, 10,
Aile Danýþmaný, 3.340, 2.500, 4.360,Sosyoloji, Psikoloji, Sosyal Hizmetler, Sosyal Hizmet, Rehberlik ve Psikolojik Danýþmanlýk, Danýþmanlýk, Eðitim, Saðlýk, Hizmet, Turizm, Anadolu Üniversitesi, Selçuk Üniversitesi, Uludað Üniversitesi, Dumlupýnar Üniversitesi, Cumhuriyet Üniversitesi, SPSS,-, -, -, -, 7,
Aile Hekimi, 9.470, 6.000, 13.570,Týp, Saðlýk Kurumlarý Ýþletmeciliði, Saðlýk Eðitimi, Endüstri ve Sistem Mühendisliði, Psikoloji, Saðlýk, Hizmet, Sigortacýlýk, Çevre, Güvenlik, Ýstanbul Üniversitesi (ÝÜ), Ege Üniversitesi, Trakya Üniversitesi, Uludað Üniversitesi, Çukurova Üniversitesi, ÝSÝG (Ýþçi Saðlýðý ve Ýþ Güvenliði) Mevzuatý,Ýþçi Saðlýðý ve Ýþ Güvenliði,-, -, -, 19,
Akademik Personel, 5.310, 3.800, 7.720,Ýþletme, Bankacýlýk ve Sigortacýlýk (MYO), Bankacýlýk ve Sigortacýlýk, Kamu Yönetimi, Ýktisat, Eðitim, Ticaret, Gýda, Hizmet, Saðlýk, Anadolu Üniversitesi, Selçuk Üniversitesi, Marmara Üniversitesi, Süleyman Demirel Üniversitesi, Ege Üniversitesi, C#,C++,Elektrik Motorlarý,Elektrik/Elektronik,Elektronik Devre Dizayný,4,
Akademisyen, 5.720, 3.440, 8.010,Ýþletme, Makine Mühendisliði, Kimya, Biyoloji, Elektrik/Elektronik Mühendisliði, Eðitim, Saðlýk, Hizmet, Yapý, Biliþim, Ýstanbul Üniversitesi (ÝÜ), Marmara Üniversitesi, Anadolu Üniversitesi, Hacettepe Üniversitesi, Yýldýz Teknik Üniversitesi (YTÜ), Adobe Illustrator,AutoCAD,C++,Elektrik/Elektronik,Ýnsan Kaynaklarý Yönetimi,13,
Aksesuar Tasarýmcýsý, 4.020, 2.500, 6.650,Moda Tasarýmý, Moda ve Tekstil Tasarýmý, Kuyumculuk ve Taký Tasarýmý (MYO), Moda Tasarýmý (MYO), Grafik (MYO), Tekstil, Maden ve Metal Sanayi, Mobilya & Aksesuar, Üretim / Endüstriyel Ürünler, Otomotiv, Dokuz Eylül Üniversitesi, Anadolu Üniversitesi, Ýstanbul Aydýn Üniversitesi, Marmara Üniversitesi, Giresun Üniversitesi, Adobe Illustrator,Adobe Photoshop,AutoCAD,CorelDraw,El Çizimi,4,
Aktif Satýþ Danýþmaný, 2.580, 2.020, 3.220,Ýþletme, Ýktisat, Dýþ Ticaret (MYO), Kamu Yönetimi, Ýþletme Yönetimi, Tekstil, Ticaret, Ev Eþyalarý, Gýda, Telekomünikasyon, Anadolu Üniversitesi, Ýstanbul Üniversitesi (ÝÜ), Selçuk Üniversitesi, Kocaeli Üniversitesi, Atatürk Üniversitesi, AutoCAD,Satýþ Yönetimi,-, -, -, 449,
Aktif Satýþ Elemaný, 2.700, 2.020, 3.470,Ýþletme, Ýktisat, Kamu Yönetimi, Dýþ Ticaret (MYO), Maliye, Tekstil, Gýda, Ticaret, Saðlýk, Hizmet, Anadolu Üniversitesi, Selçuk Üniversitesi, Kocaeli Üniversitesi, Süleyman Demirel Üniversitesi, Atatürk Üniversitesi, AutoCAD,Satýþ Yönetimi,-, -, -, 200,
Aktif Satýþ Temsilcisi, 3.150, 2.020, 4.500,Ýþletme, Ýktisat, Kamu Yönetimi, Dýþ Ticaret (MYO), Maliye, Gýda, Tekstil, Saðlýk, Telekomünikasyon, Hizmet, Anadolu Üniversitesi, Süleyman Demirel Üniversitesi, Selçuk Üniversitesi, Ýstanbul Üniversitesi (ÝÜ), Kocaeli Üniversitesi, AutoCAD,Genel Muhasebe,Muhasebe,Satýþ Yönetimi,-, 233,
Aktivasyon Elemaný, 2.390, 2.020, 2.790,Ýþletme, Bilgisayar Teknolojisi ve Programlama (MYO), Muhasebe (MYO), Kamu Yönetimi, Ýktisat, Telekomünikasyon, Biliþim, Hizmet, Ýletiþim Danýþmanlýðý, Reklam ve Tanýtým, Anadolu Üniversitesi, Kocaeli Üniversitesi, Süleyman Demirel Üniversitesi, Dumlupýnar Üniversitesi, Afyon Kocatepe Üniversitesi, BÜRO YÖNETÝMÝ VE SEKRETERLÝK,Müþteri Hizmetleri Operasyon Yönetimi,Satýþ Yönetimi,Telekomünikasyon,-, 14,
Aktivite Müdürü, 3.880, 2.500, 6.040,Ýþletme, Turizm ve Otel Ýþletmeciliði (MYO), Ýktisat, Konaklama ve Turizm Ýþletmeciliði, Uluslararasý Ýliþkiler, Turizm, Eðlence - Kültür - Sanat, Gýda, Hizmet, Reklam ve Tanýtým, Anadolu Üniversitesi, Selçuk Üniversitesi, Ýstanbul Üniversitesi (ÝÜ), Mersin Üniversitesi, Abant Ýzzet Baysal Üniversitesi, Müþteri Hizmetleri Operasyon Yönetimi,-, -, -, -, 14,
Aktüer, 4.200, 2.320, 9.020,Aktüerya Bilimleri, Matematik, Ýstatistik, Ýþletme, Fen Bilgisi Öðretmenliði, Sigortacýlýk, Mobilya & Aksesuar, Danýþmanlýk, Üretim / Endüstriyel Ürünler, Saðlýk, Hacettepe Üniversitesi, Boðaziçi Üniversitesi, Marmara Üniversitesi, Orta Doðu Teknik Üniversitesi (ODTÜ), Anadolu Üniversitesi, C#,C++,Finansal Analiz,Finansal Risk Yönetimi,Genel Muhasebe,7,
Akustik Uzmaný, -, -, -, -, -, -, -, -, -, -, -, -, -, -, -, -, -, -, -, -, -, -, -, -,
Alacak Takip Elemaný, 2.610, 2.020, 3.370,Ýþletme, Adalet Meslek Yüksekokulu (MYO), Adalet (MYO), Bankacýlýk ve Sigortacýlýk (MYO), Ýktisat, Danýþmanlýk, Finans - Ekonomi, Hizmet, Enerji, Elektrik & Elektronik, Anadolu Üniversitesi, Ýstanbul Üniversitesi (ÝÜ), Kocaeli Üniversitesi, Sakarya Üniversitesi, Marmara Üniversitesi, Genel Muhasebe,Ön Muhasebe,Photoshop,-, -, 12,
Alakart Garson, 2.720, 2.020, 3.520,Turizm ve Otel Ýþletmeciliði (MYO), Turizm Ýþletmeciliði ve Otelcilik, Ýþletme, Turizm Ýþletmeciliði, Konaklama ve Turizm Ýþletmeciliði, Turizm, Gýda, Eðlence - Kültür - Sanat, Hizmet, Biliþim, Anadolu Üniversitesi, Muðla Üniversitesi, Akdeniz Üniversitesi, Selçuk Üniversitesi, Balýkesir Üniversitesi, Futbol,Bilgisayar,Microsoft Office,Spor,Satýþ ve Pazarlama,117,
Albay, 11.750, 8.000, 16.710,Ýþletme, Makine Mühendisliði, Ýnþaat Mühendisliði,  Yönetim ve Organizasyon , Elektrik/Elektronik Mühendisliði, Güvenlik, Taþýmacýlýk, Üretim / Endüstriyel Ürünler, Hizmet, Yapý, Kara Harp Okulu, Hava Harp Okulu, Deniz Harp Okulu, Süleyman Demirel Üniversitesi, Marmara Üniversitesi, Depo Ve Lojistik Yönetimi,Ýnsan Kaynaklarý,Ýnsan Kaynaklarý Yönetimi,Proje Yönetimi,-, 4,
Algoritma Geliþtirme Mühendisi, 6.360, 3.500, 10.710,Elektrik/Elektronik Mühendisliði, Bilgisayar Mühendisliði, Elektronik Mühendisliði, Havacýlýk ve Uzay Mühendisliði, Endüstri Mühendisliði, Biliþim, Üretim / Endüstriyel Ürünler, Elektrik & Elektronik, Otomotiv, Hizmet, Orta Doðu Teknik Üniversitesi (ODTÜ), Ýhsan Doðramacý Bilkent Üniversitesi, Gazi Üniversitesi, Hacettepe Üniversitesi, Ýstanbul Teknik Üniversitesi (ÝTÜ), Adobe Photoshop,C,C#,C++,CSS3,9,
Almanca Öðretmeni, 3.000, 2.090, 3.910,Almanca Öðretmenliði, Alman Dili ve Edebiyatý, Mütercim-Tercümanlýk (Almanca) , Çeviribilim, Eðitim Bilimleri, Eðitim, Danýþmanlýk, Turizm, Hizmet, Tekstil, Hacettepe Üniversitesi, Ýstanbul Üniversitesi (ÝÜ), Marmara Üniversitesi, Çukurova Üniversitesi, Anadolu Üniversitesi, Microsoft Office,Resim,Müzik,Microsoft Office Word,Spor,105,
Alternatif Kanal Geliþtirme Uzmaný, -, -, -, -, -, -, -, -, -, -, -, -, -, -, -, -, -, -, -, -, -, -, -, -,
Altyapý Mühendisi, 5.810, 2.650, 8.970,Ýnþaat Mühendisliði, Çevre Mühendisliði, Makine Mühendisliði, Elektrik/Elektronik Mühendisliði, Jeoloji Mühendisliði, Yapý, Hizmet, Elektrik & Elektronik, Enerji, Biliþim, Yýldýz Teknik Üniversitesi (YTÜ), Ýstanbul Teknik Üniversitesi (ÝTÜ), Sakarya Üniversitesi, Dokuz Eylül Üniversitesi, Çukurova Üniversitesi, 2D Autocad,ArcGIS,AutoCAD,Hakediþ Düzenlenmesi,LAN (Local Area Network),30,
Alüminyum Doðrama Ustasý, 3.360, 2.800, 3.990,Makine (MYO), Kamu Yönetimi, Ýþletme, Gýda Teknolojisi, Elektrik (MYO), Maden ve Metal Sanayi, Yapý, Üretim / Endüstriyel Ürünler, Kimya, Reklam ve Tanýtým, Anadolu Üniversitesi, Gazi Üniversitesi, Kýrýkkale Üniversitesi, Dumlupýnar Üniversitesi, Fýrat Üniversitesi, Elektrik/Elektronik,-, -, -, -, 12,
Alüminyum Küpeþte ustasý, -, -, -, Bilgisayar Programcýlýðý, Makine, Maden ve Metal Sanayi, Yapý, Kimya, -, -, -, -, -, -, -, -, -, -, Üretim,-, -, -, -, -,
Ambulans Hekimi, 9.750, 8.000, 15.000,Týp, Ýlk ve Acil (Paramedik), Acil Yardým ve Afet Yönetimi, Matematik Öðretmenliði, Acil Yardým Teknikerliði (MYO), Saðlýk, Sigortacýlýk, Hizmet, Çevre, Arþiv Yönetimi ve Saklama, Ýstanbul Üniversitesi (ÝÜ), Cumhuriyet Üniversitesi, Ege Üniversitesi, Marmara Üniversitesi, Namýk Kemal Üniversitesi, Ýþ Zekasý,Radyo ve TV teknolojileri,-, -, -, 4,
Ambulans Þoförü, 2.480, 2.020, 3.140,Ýþletme, Elektrik (MYO), Otomotiv (MYO), Kamu Yönetimi, Ýlk ve Acil (Paramedik), Saðlýk, Hizmet, Taþýmacýlýk, Sigortacýlýk, Biliþim, Anadolu Üniversitesi, Atatürk Üniversitesi, Kocaeli Üniversitesi, Ege Üniversitesi, Ýnönü Üniversitesi, Src 2,Src 4,-, -, -, 25,
Ameliyathane Hemþiresi, 3.200, 2.250, 4.140,Ameliyathane Teknikerliði (MYO), Hemþirelik ve Saðlýk Hizmetleri, Hemþirelik (MYO), Hemþirelik, Ebelik , Saðlýk, Hizmet, Sigortacýlýk, Eðitim, Tekstil, Anadolu Üniversitesi, Ýstanbul Bilim Üniversitesi, Niþantaþý Üniversitesi, Ýstanbul Yeni Yüzyýl Üniversitesi, Ýstanbul Medipol Üniversitesi , Ýþçi Saðlýðý ve Ýþ Güvenliði,Sterilizasyon,-, -, -, 203,
Ameliyathane Personeli, 2.550, 2.020, 3.110,Ameliyathane Teknikerliði (MYO), Biyomedikal Cihaz Teknolojisi (MYO), Biyoloji, Büro Yönetimi ve Yönetici Asistanlýðý (MYO), Týbbi Dokümantasyon ve Sekreterlik (MYO), Saðlýk, Hizmet, Sigortacýlýk, Gýda, Taþýmacýlýk, Anadolu Üniversitesi, Atatürk Üniversitesi, Üsküdar Üniversitesi , Niþantaþý Üniversitesi Meslek Yüksekokulu, Kocaeli Üniversitesi, Sterilizasyon,-, -, -, -, 29,
Analist, 4.870, 2.020, 7.860,Kimya, Endüstri Mühendisliði, Bilgisayar Mühendisliði, Ýþletme, Ýstatistik, Finans - Ekonomi, Saðlýk, Biliþim, Danýþmanlýk, Gýda, Ýstanbul Üniversitesi (ÝÜ), Marmara Üniversitesi, Ýstanbul Teknik Üniversitesi (ÝTÜ), Kocaeli Üniversitesi, Boðaziçi Üniversitesi, Analiz Yöntemleri,C#,GCMS / HPLC,Ýþ ve süreç analizi,Java,280,
Analitik Crm Uzmaný, 6.000, 5.000, 7.410,Endüstri Mühendisliði, Ýstatistik, Ýþletme, Matematik, Bilgisayar Teknolojisi ve Programlama (MYO), Finans - Ekonomi, Telekomünikasyon, Biliþim, Sigortacýlýk, Perakende, Ýstanbul Teknik Üniversitesi (ÝTÜ), Yýldýz Teknik Üniversitesi (YTÜ), Marmara Üniversitesi, Boðaziçi Üniversitesi, Ýstanbul Üniversitesi (ÝÜ), Big Data,CRM,Dijital Pazarlama,Ýstatistiksel analiz,MS Access,5,
Analitik CRM Yöneticisi, -, -, -, Endüstri Mühendisliði, Ýstatistik, Ýktisat, Ýþletme, Elektrik/Elektronik Mühendisliði, Finans - Ekonomi, Perakende, Yapý, Danýþmanlýk, Telekomünikasyon, Yýldýz Teknik Üniversitesi (YTÜ), Dokuz Eylül Üniversitesi, Ýstanbul Üniversitesi (ÝÜ), Erciyes Üniversitesi, Boðaziçi Üniversitesi, ASP.NET,C,C#,CRM,Dijital Pazarlama,-,
Analitik Metod Geliþtirme Uzmaný, -, -, -, Kimya, Kimya Mühendisliði, Endüstri Mühendisliði, Kimya (MYO), Ýþletme, Saðlýk, Otomotiv, Kimya, Eðitim, Maden ve Metal Sanayi, Ýstanbul Üniversitesi (ÝÜ), Ýstanbul Teknik Üniversitesi (ÝTÜ), Balýkesir Üniversitesi, Eskiþehir Osmangazi Üniversitesi, Ege Üniversitesi, 5S,Analiz Yöntemleri,Analytical Chemistry,Chromatography,GCMS / HPLC,-,
Analitik Metod Validasyon Uzmaný, 6.220, 6.000, 6.520,-, -, -, -, -, -, -, -, -, -, -, -, -, -, -, -, -, -, -, -, 3,
Analiz Teknikeri, 3.460, 2.500, 4.460,-, -, -, -, -, -, -, -, -, -, -, -, -, -, -, -, -, -, -, -, 12,
Analiz Uzmaný, 3.590, 2.020, 5.660,Kimya, Ýþletme, Ýstatistik, Endüstri Mühendisliði, Bilgisayar Teknolojisi ve Programlama (MYO), Biliþim, Saðlýk, Hizmet, Finans - Ekonomi, Gýda, Anadolu Üniversitesi, Kocaeli Üniversitesi, Ýstanbul Üniversitesi (ÝÜ), Dokuz Eylül Üniversitesi, Gazi Üniversitesi, Adobe Photoshop,Analiz Yöntemleri,AutoCAD,C#,GCMS / HPLC,10,
Analiz ve Raporlama Uzmaný, 3.810, 2.400, 5.850,Ýstatistik, Ýþletme, Endüstri Mühendisliði, Bilgisayar Teknolojisi ve Programlama (MYO), Ýktisat, Finans - Ekonomi, Hizmet, Telekomünikasyon, Sigortacýlýk, Enerji, Anadolu Üniversitesi, Marmara Üniversitesi, Ýstanbul Üniversitesi (ÝÜ), Sakarya Üniversitesi, Yýldýz Teknik Üniversitesi (YTÜ), Bütçe planlama ve raporlama,Finansal Analiz,Finansal Raporlama,Ýstatistiksel analiz,Ýþ ve süreç analizi,43,
Anaokulu Müdürü, 4.510, 2.750, 6.270,Okul Öncesi Öðretmenlik, Çocuk Geliþimi (MYO), Çocuk Geliþimi ve Eðitimi, Çocuk Geliþimi ve Eðitimi Öðretmenliði, Psikoloji, Eðitim, Hizmet, Danýþmanlýk, Biliþim, Tekstil, Anadolu Üniversitesi, Gazi Üniversitesi, Marmara Üniversitesi, Hacettepe Üniversitesi, Selçuk Üniversitesi, Resim,Müzik,Tiyatro,Tasarým,Bilgisayar,14,
Anaokulu Öðretmeni, 2.590, 2.020, 3.280,Çocuk Geliþimi (MYO), Okul Öncesi Öðretmenlik, Çocuk Geliþimi ve Eðitimi, Sosyal Hizmetler, Çocuk Geliþimi ve Eðitimi Öðretmenliði, Eðitim, Danýþmanlýk, Hizmet, Saðlýk, Tekstil, Anadolu Üniversitesi, Atatürk Üniversitesi, Ýstanbul Aydýn Üniversitesi, Ýstanbul Arel Üniversitesi, Ýstanbul Üniversitesi (ÝÜ), Çocuk Geliþimi,-, -, -, -, 361,
Anatomi Öðretmeni, -, -, -, Hemþirelik, Hemþirelik (MYO), Hemþirelik ve Saðlýk Hizmetleri, Ebelik , Biyoloji, Eðitim, Saðlýk, Hizmet, Biliþim, Ticaret, Ýstanbul Üniversitesi (ÝÜ), Ege Üniversitesi, Atatürk Üniversitesi, Gazi Üniversitesi, Gaziosmanpaþa Üniversitesi, Ýþ Zekasý,Ýþçi Saðlýðý ve Ýþ Güvenliði,-, -, -, -,
Android Geliþtirici, 5.390, 2.260, 8.520,Bilgisayar Mühendisliði, Yazýlým Mühendisliði, Bilgisayar ve Öðretim Teknolojileri Öðr., Bilgisayar Programcýlýðý, Elektrik/Elektronik Mühendisliði, Biliþim, Elektrik & Elektronik, Telekomünikasyon, Reklam ve Tanýtým, Ticaret, Sakarya Üniversitesi, Fýrat Üniversitesi, Ýstanbul Üniversitesi (ÝÜ), Yýldýz Teknik Üniversitesi (YTÜ), Bilecik Þeyh Edebali Üniversitesi, Android,Android Programlama,Android Studio,Android Uygulama Geliþtirme,C#,82,
Anestezi Doktoru, 14.860, 10.000, 19.910,Týp, Anestezi (MYO),  Cerrahi Týp Bilimleri, Hastane Yönetimi ve Organizasyon (MYO), Saðlýk, -, -, -, -, -, Ýstanbul Üniversitesi (ÝÜ), Ankara Üniversitesi, Hacettepe Üniversitesi, Trakya Üniversitesi, Ondokuz Mayýs Üniversitesi, Adobe Flash,Ýþçi Saðlýðý ve Ýþ Güvenliði,-, -, -, 20,
Anestezi Hemþiresi, 2.650, 2.500, 2.850,Anestezi Teknikerliði (MYO), Hemþirelik ve Saðlýk Hizmetleri, Anestezi (MYO), Hemþirelik (MYO), Hemþirelik, Saðlýk, Hizmet, Sigortacýlýk, Çevre, Biliþim, Anadolu Üniversitesi, Atatürk Üniversitesi, Ýstanbul Aydýn Üniversitesi, Trakya Üniversitesi, Marmara Üniversitesi, Entübasyon,Ýþçi Saðlýðý ve Ýþ Güvenliði,-, -, -, 3,
Anestezi Teknikeri, 2.700, 2.070, 3.320,Anestezi Teknikerliði (MYO), Anestezi (MYO), Kimya, Biyoloji, Kamu Yönetimi, Saðlýk, Hizmet, Sigortacýlýk, Tekstil, Eðitim, Ýstanbul Bilim Üniversitesi, Marmara Üniversitesi, Ýstanbul Aydýn Üniversitesi, Ýstanbul Arel Üniversitesi, Trakya Üniversitesi, Ýþçi Saðlýðý ve Ýþ Güvenliði,-, -, -, -, 212,
Anestezi Teknisyeni, 2.680, 2.110, 3.250,Anestezi Teknikerliði (MYO), Anestezi (MYO), Saðlýk Kurumlarý Ýþletmeciliði, Hemþirelik ve Saðlýk Hizmetleri, Hemþirelik (MYO), Saðlýk, Hizmet, Sigortacýlýk, Eðitim, Gýda, Anadolu Üniversitesi, Ýstanbul Medipol Üniversitesi , Marmara Üniversitesi, Üsküdar Üniversitesi , Dokuz Eylül Üniversitesi, Ýþçi Saðlýðý ve Ýþ Güvenliði,-, -, -, -, 42,
Anestezi Uzmaný, -, -, -, Týp, Anestezi (MYO), Ýþletme, Hayvan Yetiþtiriciliði ve Saðlýðý (MYO),  Cerrahi Týp Bilimleri, -, -, -, -, -, Ýstanbul Üniversitesi (ÝÜ), Ankara Üniversitesi, Hacettepe Üniversitesi, Uludað Üniversitesi, Trakya Üniversitesi, Müzik,Microsoft Office Word,9 Yýldýr Fotoðrafçýlýkla Ýlgileniyorum,- Takým Halinde Uyumlu Çalýþabilme ( Koro, Spor Takýmlarý, Bilimsel Çalýþma Gruplarý ),PowerPoint,-,
Animasyon Sanatçýsý, -, -, -, Turizm ve Seyahat Ýþletmeciliði (MYO), Çizgi Film (Animasyon), Turizm ve Otel Ýþletmeciliði (MYO), Turizm Animasyon, Ýngiliz Dili ve Edebiyatý, Turizm, Reklam ve Tanýtým, Eðlence - Kültür - Sanat, Hizmet, Medya, Anadolu Üniversitesi, Akdeniz Üniversitesi, Mersin Üniversitesi, Muðla Üniversitesi, Dokuz Eylül Üniversitesi, 3D Max,Adobe After Effects,Adobe Flash,Adobe Illustrator,Adobe Photoshop,-,
Animatör, 2.820, 2.020, 3.640,Turizm Animasyon, Turizm ve Otel Ýþletmeciliði (MYO), Turizm Ýþletmeciliði, Ýþletme, Beden Eðitimi ve Spor Öðretmenliði, Turizm, Reklam ve Tanýtým, Eðlence - Kültür - Sanat, Hizmet, Eðitim, Anadolu Üniversitesi, Akdeniz Üniversitesi, Muðla Üniversitesi, Ege Üniversitesi, Mersin Üniversitesi, Adobe After Effects,Adobe Photoshop,-, -, -, 26,
Anjiyo Hemþiresi, 3.280, 2.040, 4.600,Hemþirelik ve Saðlýk Hizmetleri, Hemþirelik (MYO), Hemþirelik, Saðlýk Kurumlarý Ýþletmeciliði, Ýlk ve Acil (Paramedik), Saðlýk, Hizmet, Sigortacýlýk, Kimya, Eðitim, Anadolu Üniversitesi, Marmara Üniversitesi, Uludað Üniversitesi, Ýstanbul Üniversitesi (ÝÜ), Ýstanbul Aydýn Üniversitesi, Cpr,Ýþçi Saðlýðý ve Ýþ Güvenliði,-, -, -, 17,
Anjiyo Teknisyeni, 3.260, 2.440, 4.080,Týbbi Görüntüleme Teknikleri, Radyoloji (MYO), Biyoloji, Biyomedikal Cihaz Teknolojisi (MYO), Týbbi Laboratuvar (MYO), Saðlýk, Hizmet, Sigortacýlýk, Basým - Yayýn, Atýk Yönetimi ve Geri Dönüþüm, Anadolu Üniversitesi, Selçuk Üniversitesi, Ankara Üniversitesi, Erciyes Üniversitesi, Ýnönü Üniversitesi, Ýþ Zekasý,Kalite Yönetim Sistemleri,PARAMEDÝK,-, -, 18,
