Proje Yöneticisi / Yönetmeni, 6.670, 2.140, 11.200,Bilgisayar Mühendisliði, Endüstri Mühendisliði, Makine Mühendisliði, Ýþletme, Elektrik/Elektronik Mühendisliði, Biliþim, Yapý, Hizmet, Reklam ve Tanýtým, Gýda, Anadolu Üniversitesi, Ýstanbul Teknik Üniversitesi (ÝTÜ), Yýldýz Teknik Üniversitesi (YTÜ), Orta Doðu Teknik Üniversitesi (ODTÜ), Ýstanbul Üniversitesi (ÝÜ), Adobe Photoshop,AutoCAD,C#,ERP,HTML,509,
Promosyon Uzmaný, -, -, -, -, -, -, -, -, -, -, -, -, -, -, -, -, -, -, -, -, -, -, -, -,
Promotör, 2.540, 2.020, 3.250,Ýþletme, Ýktisat, Bilgisayar Programcýlýðý, Kamu Yönetimi, Bilgisayar Teknolojisi ve Programlama (MYO), Elektrik & Elektronik, Telekomünikasyon, Ticaret, Ev Eþyalarý, Biliþim, Anadolu Üniversitesi, Ýstanbul Üniversitesi (ÝÜ), Akdeniz Üniversitesi, Çanakkale 18 Mart Üniversitesi, Marmara Üniversitesi, Adobe Photoshop,AutoCAD,Satýþ Yönetimi,-, -, 26,
Protez Ortez Teknikeri, -, -, -, Protez ve Ortez (MYO), Kamu Yönetimi, Çaðdaþ Türk Lehçeleri ve Edebiyatlarý, Biyomedikal Mühendisliði, Saðlýk Eðitimi, -, -, -, -, -, Hacettepe Üniversitesi, Eskiþehir Osmangazi Üniversitesi, Ýstanbul Aydýn Üniversitesi, Ankara Üniversitesi, Trakya Üniversitesi, Satýþ Yönetimi,-, -, -, -, -,
Prototip Mühendisi, 6.150, 5.000, 7.450,-, -, -, -, -, -, -, -, -, -, -, -, -, -, -, -, -, -, -, -, 4,
Prova Mankeni, 4.500, 2.500, 6.530,Moda Tasarýmý (MYO), Ýktisat, Uluslararasý Ýliþkiler, Çocuk Geliþimi (MYO), Moda Tasarýmý, Tekstil, Reklam ve Tanýtým, Turizm, Ticaret, Eðitim, Anadolu Üniversitesi, Ýstanbul Üniversitesi (ÝÜ), Beykent Üniversitesi, Ýstanbul Aydýn Üniversitesi, Marmara Üniversitesi, Spor,Basketbol,Futbol,Müzik,Yüzme,7,
Psikiyatri Uzmaný, 13.000, 9.000, 17.580,Týp, Psikoloji,  Klinik Psikoloji, Radyoterapi (MYO), Ýletiþim Sanatlarý, Saðlýk, Hizmet, Sigortacýlýk, Danýþmanlýk, Güvenlik, Ýstanbul Üniversitesi (ÝÜ), Ege Üniversitesi, Hacettepe Üniversitesi, Gülhane Askeri Týp Akademisi, Marmara Üniversitesi, Etkili Ýletiþim,Omni,Ýstatistiksel analiz,Wpqr,Kayýt Yönetimi,8,
Psikolog, 3.050, 2.020, 4.280,Psikoloji, Rehberlik ve Psikolojik Danýþmanlýk, Sosyoloji,  Klinik Psikoloji, Ýþletme, Eðitim, Saðlýk, Danýþmanlýk, Hizmet, Topluluklar, Ýstanbul Üniversitesi (ÝÜ), Ege Üniversitesi, Hacettepe Üniversitesi, Uludað Üniversitesi, Maltepe Üniversitesi, SPSS,-, -, -, -, 236,
Psikolojik Danýþman, 2.930, 2.020, 3.880,Rehberlik ve Psikolojik Danýþmanlýk, Psikoloji, Sosyoloji, Felsefe, Eðitim Bilimleri, Eðitim, Danýþmanlýk, Saðlýk, Hizmet, Topluluklar, Ýstanbul Üniversitesi (ÝÜ), Marmara Üniversitesi, Yeditepe Üniversitesi, Boðaziçi Üniversitesi, Ankara Üniversitesi, SPSS,-, -, -, -, 91,
Psikoterapist, -, -, -, Psikoloji, Rehberlik ve Psikolojik Danýþmanlýk, Týp,  Klinik Psikoloji, Fizik, Saðlýk, Hizmet, Danýþmanlýk, Eðitim, Sigortacýlýk, Ýstanbul Üniversitesi (ÝÜ), Ýstanbul Bilgi Üniversitesi, Marmara Üniversitesi, Orta Doðu Teknik Üniversitesi (ODTÜ), Boðaziçi Üniversitesi, Sosyal Hizmetler,SPSS,-, -, -, -,
Puantör, 2.990, 2.020, 4.090,Ýþletme, Deniz ve Liman Ýþletme (MYO), Ýktisat, Dýþ Ticaret (MYO), Kamu Yönetimi, Yapý, Denizcilik, Taþýmacýlýk, Hizmet, Maden ve Metal Sanayi, Anadolu Üniversitesi, Kocaeli Üniversitesi, Süleyman Demirel Üniversitesi, Uludað Üniversitesi, Dumlupýnar Üniversitesi, AutoCAD,SAP,-, -, -, 89,
Punch Operatörü, 2.700, 2.070, 3.330,Makine (MYO), Otomotiv (MYO), Makina Resim Konstrüksiyon, Muhasebe ve Vergi Uygulamalarý, Mekatronik (MYO), Maden ve Metal Sanayi, Elektrik & Elektronik, Üretim / Endüstriyel Ürünler, Yapý, Ev Eþyalarý, Kocaeli Üniversitesi, Gaziosmanpaþa Üniversitesi, Dokuz Eylül Üniversitesi, Necmettin Erbakan Üniversitesi, Akdeniz Üniversitesi, Adobe Photoshop,AutoCAD,Corel Draw,E SINIFI EHLÝYET,Genel Muhasebe,15,
Radyoloji Hemþiresi, 2.950, 2.300, 3.910,Týbbi Görüntüleme Teknikleri, Hemþirelik (MYO), Radyoloji (MYO), Laborant ve Veteriner Saðlýk  (MYO), Hemþirelik ve Saðlýk Hizmetleri, -, -, -, -, -, Anadolu Üniversitesi, Üsküdar Üniversitesi , Biruni Üniversitesi, Çanakkale 18 Mart Üniversitesi, Kapadokya Meslek Yüksekokulu, Müzik,Atýlýmcýlýk,Amatör Fotoðrafçýlýk,Hedefleri Olan,Ýletiþim Becerisi Yüksek,4,
Radyoloji Raportörü, 2.490, 2.020, 3.050,Týbbi Dokümantasyon ve Sekreterlik (MYO), Ýþletme, Bilgisayar Teknolojisi ve Programlama (MYO), Büro Yönetimi ve Sekreterlik (MYO), Saðlýk Kurumlarý Ýþletmeciliði, Saðlýk, Hizmet, Sigortacýlýk, Eðitim, Reklam ve Tanýtým, Anadolu Üniversitesi, Ýstanbul Üniversitesi (ÝÜ), Süleyman Demirel Üniversitesi, Balýkesir Üniversitesi, Kocaeli Üniversitesi, Raporlama,Týbbi Terminoloji,-, -, -, 33,
Radyoloji Teknikeri, 2.570, 2.020, 3.270,Týbbi Görüntüleme Teknikleri, Radyoloji (MYO), Radyoterapi (MYO), Ýþletme, Biyomedikal Cihaz Teknolojisi (MYO), Saðlýk, Hizmet, Sigortacýlýk, Çevre, Eðitim, Ýstanbul Üniversitesi (ÝÜ), Marmara Üniversitesi, Ýstanbul Aydýn Üniversitesi, Ýstanbul Bilim Üniversitesi, Üsküdar Üniversitesi , Röntgen,-, -, -, -, 207,
Radyoloji Teknisyeni, 2.620, 2.020, 3.320,Týbbi Görüntüleme Teknikleri, Radyoloji (MYO), Radyoterapi (MYO), Saðlýk Kurumlarý Ýþletmeciliði, Biyomedikal Cihaz Teknolojisi (MYO), Saðlýk, Hizmet, Sigortacýlýk, Çevre, Eðitim, Ýstanbul Üniversitesi (ÝÜ), Marmara Üniversitesi, Anadolu Üniversitesi, Dokuz Eylül Üniversitesi, Gazi Üniversitesi, Röntgen,-, -, -, -, 22,
Radyoloji Uzmaný, 17.070, 12.460, 21.680,Týp, Radyoloji (MYO), Dahili Týp Bilimleri, Saðlýk Eðitimi, Fizik, Saðlýk, Hizmet, Sigortacýlýk, Eðitim, Üretim / Endüstriyel Ürünler, Ýstanbul Üniversitesi (ÝÜ), Ankara Üniversitesi, Hacettepe Üniversitesi, Ege Üniversitesi, Dokuz Eylül Üniversitesi, Muhasebe,-, -, -, -, 25,
Radyoterapi Teknikeri, 3.030, 2.020, 4.340,Radyoterapi (MYO), Radyoloji (MYO), Týbbi Görüntüleme Teknikleri, Biyoloji, Ýþletme, Saðlýk, Hizmet, Sigortacýlýk, Tekstil, Eðitim, Acýbadem Üniversitesi , Ýstanbul Aydýn Üniversitesi, Niþantaþý Üniversitesi, Ýstanbul Medipol Üniversitesi , Ýstanbul Üniversitesi (ÝÜ), Ýþçi Saðlýðý ve Ýþ Güvenliði,-, -, -, -, 34,
Raporlama Uzmaný, 4.460, 2.310, 6.610,Ýþletme, Ýstatistik, Bilgisayar Teknolojisi ve Programlama (MYO), Endüstri Mühendisliði, Ýktisat, Hizmet, Finans - Ekonomi, Sigortacýlýk, Telekomünikasyon, Enerji, Anadolu Üniversitesi, Ýstanbul Üniversitesi (ÝÜ), Marmara Üniversitesi, Sakarya Üniversitesi, Yýldýz Teknik Üniversitesi (YTÜ), Bütçe planlama ve raporlama,Finansal Raporlama,Ýþ ve süreç analizi,MS SQL Server,Photoshop,72,
Raportör, 2.880, 2.020, 3.880,Ýþletme, Bankacýlýk ve Sigortacýlýk (MYO), Týbbi Dokümantasyon ve Sekreterlik (MYO), Bankacýlýk ve Sigortacýlýk, Ýktisat, Sigortacýlýk, Saðlýk, Hizmet, Otomotiv, Yapý, Anadolu Üniversitesi, Ýstanbul Üniversitesi (ÝÜ), Kocaeli Üniversitesi, Selçuk Üniversitesi, Uludað Üniversitesi, Adobe Photoshop,AutoCAD,Java,Muhasebe,Raporlama,44,
Raylý Sistemler Mühendisi, 5.460, 3.200, 8.720,-, -, -, -, -, -, -, -, -, -, -, -, -, -, -, -, -, -, -, -, 5,
Redaktör, 3.030, 2.600, 3.910,Türk Dili ve Edebiyatý, Türkçe Öðretmenliði, Gazetecilik, Türk Dili ve Edebiyatý Öðretmenliði, Tarih, Basým - Yayýn, Eðitim, Medya, Hizmet, Reklam ve Tanýtým, Ýstanbul Üniversitesi (ÝÜ), Ankara Üniversitesi, Gazi Üniversitesi, Hacettepe Üniversitesi, Ege Üniversitesi, Adobe Illustrator,Adobe Photoshop,InDesign,Sosyal Medya Yönetimi,-, 3,
Rehber Öðretmen, 2.900, 2.090, 3.710,Sosyoloji, Felsefe, Rehberlik ve Psikolojik Danýþmanlýk, Felsefe Grubu Öðretmenliði, Psikoloji, Eðitim, Danýþmanlýk, Turizm, Hizmet, Biliþim, Anadolu Üniversitesi, Sakarya Üniversitesi, Pamukkale Üniversitesi, Ýstanbul Üniversitesi (ÝÜ), Uludað Üniversitesi, Rehberlik,SPSS,-, -, -, 337,
Rehberlik ve Psikolojik Danýþman, 3.200, 2.220, 4.260,Rehberlik ve Psikolojik Danýþmanlýk, Sosyoloji, Psikoloji, Felsefe, Felsefe Grubu Öðretmenliði, Eðitim, Danýþmanlýk, Saðlýk, Hizmet, Turizm, Sakarya Üniversitesi, Ýstanbul Üniversitesi (ÝÜ), Pamukkale Üniversitesi, Uludað Üniversitesi, Anadolu Üniversitesi, SPSS,-, -, -, -, 95,
Rejisör, -, -, -, Radyo - Sinema ve Televizyon, Radyo ve Televizyon Programcýlýðý (MYO), Sinema ve Televizyon, Gazetecilik, Radyo ve Televizyon, Medya, Basým - Yayýn, Eðlence - Kültür - Sanat, Reklam ve Tanýtým, Eðitim, Anadolu Üniversitesi, Beykent Üniversitesi, Selçuk Üniversitesi, Kocaeli Üniversitesi, Erciyes Üniversitesi, Adobe After Effects,Adobe Illustrator,Adobe Photoshop,Adobe Premiere Pro,Sosyal Medya,-,
Reklam Danýþmaný, 4.500, 3.000, 6.070,Ýþletme, Halkla Ýliþkiler ve Tanýtým, Reklamcýlýk, Halkla Ýliþkiler ve Reklamcýlýk, Pazarlama (MYO), Reklam ve Tanýtým, Medya, Basým - Yayýn, Biliþim, Hizmet, Anadolu Üniversitesi, Kocaeli Üniversitesi, Selçuk Üniversitesi, Ýstanbul Üniversitesi (ÝÜ), Marmara Üniversitesi, Adobe After Effects,Adobe Dreamweaver,Adobe Photoshop,CSS,CSS3,7,
Reklam Müdürü, 3.040, 2.020, 5.080,Ýþletme, Halkla Ýliþkiler ve Reklamcýlýk, Halkla Ýliþkiler, Ýktisat, Kamu Yönetimi, Medya, Reklam ve Tanýtým, Basým - Yayýn, Turizm, Biliþim, Anadolu Üniversitesi, Ýstanbul Üniversitesi (ÝÜ), Marmara Üniversitesi, Ege Üniversitesi, Uludað Üniversitesi, Adobe After Effects,Adobe Flash,Adobe Illustrator,Adobe Photoshop,CorelDraw,6,
Reklam Satýþ Temsilcisi, -, -, -, Ýþletme, Halkla Ýliþkiler ve Reklamcýlýk, Ýktisat, Radyo ve Televizyon Programcýlýðý (MYO), Radyo - Sinema ve Televizyon, Medya, Reklam ve Tanýtým, Basým - Yayýn, Turizm, Biliþim, Anadolu Üniversitesi, Beykent Üniversitesi, Ýstanbul Üniversitesi (ÝÜ), Marmara Üniversitesi, Dokuz Eylül Üniversitesi, Adobe After Effects,Adobe Illustrator,Adobe Photoshop,Ýþ ve süreç analizi,Proje Yönetimi,-,
Reklam ve Halkla Ýliþkiler Sorumlusu, -, -, -, Halkla Ýliþkiler ve Tanýtým, Halkla Ýliþkiler ve Reklamcýlýk, Ýþletme, Halkla Ýliþkiler, Halkla Ýliþkiler ve Tanýtým (MYO), Reklam ve Tanýtým, Medya, Basým - Yayýn, Eðitim, Yapý, Anadolu Üniversitesi, Gazi Üniversitesi, Selçuk Üniversitesi, Ýstanbul Üniversitesi (ÝÜ), Beykent Üniversitesi, Adobe Illustrator,Adobe Photoshop,Dijital Pazarlama,Halkla Ýliþkiler,Mobil Pazarlama,-,
Reklam Yazarý, 3.080, 2.020, 4.400,Reklamcýlýk, Halkla Ýliþkiler ve Reklamcýlýk, Halkla Ýliþkiler ve Tanýtým, Ýþletme, Gazetecilik, Reklam ve Tanýtým, Medya, Biliþim, Ticaret, Basým - Yayýn, Anadolu Üniversitesi, Ege Üniversitesi, Ankara Üniversitesi, Marmara Üniversitesi, Ýstanbul Üniversitesi (ÝÜ), Adobe Illustrator,Adobe Photoshop,Dijital Pazarlama,Metin Yazarlýðý,Mobil Pazarlama,14,
Renk Analisti, 3.490, 2.300, 5.260,Kimya, Tekstil (MYO), Kimya (MYO), Tasarým ve Basým-Yayýmcýlýk (MYO), Kimya Teknolojisi (MYO), Tekstil, Kimya, Üretim / Endüstriyel Ürünler, Medya, Basým - Yayýn, Ege Üniversitesi, Kýrklareli Üniversitesi, Adnan Menderes Üniversitesi, Yýldýz Teknik Üniversitesi (YTÜ), Trakya Üniversitesi, Adobe Dreamweaver,Adobe Illustrator,Adobe Photoshop,CorelDraw,Freehand,3,
Renk Uzmaný, 3.600, 2.020, 5.240,Kimya, Tekstil (MYO), Boya Teknolojisi (MYO), Kimya Mühendisliði, Kimya Teknolojisi (MYO), Kimya, Tekstil, Üretim / Endüstriyel Ürünler, Basým - Yayýn, Medya, Kocaeli Üniversitesi, Anadolu Üniversitesi, Marmara Üniversitesi, Uludað Üniversitesi, Ege Üniversitesi, Adobe Photoshop,ISO 14000,ISO 9000,ISO 9001,-, 15,
Resepsiyonist, 2.560, 2.020, 3.150,Turizm ve Otel Ýþletmeciliði (MYO), Turizm Ýþletmeciliði, Ýþletme, Konaklama Ýþletmeciliði, Turizm Ýþletmeciliði ve Otelcilik, Turizm, Otomotiv, Hizmet, Saðlýk, Eðitim, Anadolu Üniversitesi, Akdeniz Üniversitesi, Muðla Üniversitesi, Balýkesir Üniversitesi, Selçuk Üniversitesi, Adobe Photoshop,-, -, -, -, 550,
Resim Öðretmeni, 2.620, 2.020, 3.250,Resim-Ýþ Öðretmenliði, Resim, Güzel Sanatlar, Mesleki Resim Öðretmenliði, Geleneksel Türk El Sanatlarý, Eðitim, Eðlence - Kültür - Sanat, Danýþmanlýk, Tekstil, Hizmet, Marmara Üniversitesi, Gazi Üniversitesi, Dokuz Eylül Üniversitesi, Uludað Üniversitesi, Mimar Sinan Güzel Sanatlar Üniversitesi, Adobe Illustrator,Adobe Photoshop,CorelDraw,Grafik Tasarým,Photoshop,8,
Restoran Müdürü, 3.730, 2.430, 5.030,Ýþletme, Turizm ve Otel Ýþletmeciliði (MYO), Turizm - Otelcilik, Kamu Yönetimi, Ýktisat, Gýda, Turizm, Eðlence - Kültür - Sanat, Hizmet, Hýzlý Tüketim Mallarý, Anadolu Üniversitesi, Ýstanbul Üniversitesi (ÝÜ), Akdeniz Üniversitesi, Afyon Kocatepe Üniversitesi, Sakarya Üniversitesi, Depo Ve Stok Yönetimi,Ýnsan Kaynaklarý Yönetimi,Muhasebe,Nakit Yönetimi,Satýþ Yönetimi,135,
Restorasyon Teknikeri, 3.550, 2.020, 5.100,Mimari Restorasyon, Restorasyon (MYO), Restorasyon ve Konservasyon (MYO), Mimari Dekoratif Sanatlar (MYO), Mimarlýk, Yapý, Hizmet, Eðlence - Kültür - Sanat, Turizm, Mobilya & Aksesuar, Karabük Üniversitesi, Dumlupýnar Üniversitesi, Yýldýz Teknik Üniversitesi (YTÜ), Süleyman Demirel Üniversitesi, Fatih Sultan Mehmet Üniversitesi , 2D Autocad,3D Max,3D Studio Max,Adobe Photoshop,AutoCAD,12,
Restoratör, 2.800, 2.300, 3.330,Mimari Restorasyon, Restorasyon (MYO), Restorasyon ve Konservasyon (MYO), Taþýnabilir Kültür Varlýklarýný Koruma ve Onarým, Mimari Dekoratif Sanatlar (MYO), Yapý, Eðlence - Kültür - Sanat, Hizmet, Eðitim, Turizm, Dumlupýnar Üniversitesi, Yýldýz Teknik Üniversitesi (YTÜ), Süleyman Demirel Üniversitesi, Karabük Üniversitesi, Muðla Üniversitesi, 3D Max,3D Studio Max,Adobe Illustrator,Adobe Photoshop,AutoCAD,12,
Reyon Görevlisi, -, -, -, Ýþletme, Kamu Yönetimi, Ýktisat, Maliye, Bilgisayar Teknolojisi ve Programlama (MYO), Ticaret, Gýda, Tekstil, Perakende, Hizmet, Anadolu Üniversitesi, Selçuk Üniversitesi, Süleyman Demirel Üniversitesi, Akdeniz Üniversitesi, Kocaeli Üniversitesi, Bilgisayar,Microsoft Office,Satýþ ve Pazarlama,Futbol,Microsoft Office Word,-,
RF Planlama Mühendisi, 3.540, 2.680, 5.240,Elektronik ve Haberleþme Müh., Elektrik/Elektronik Mühendisliði, Elektronik Mühendisliði, Bilgisayar Mühendisliði, Endüstri Mühendisliði, -, -, -, -, -, Kocaeli Üniversitesi, Ýstanbul Teknik Üniversitesi (ÝTÜ), Uludað Üniversitesi, Çankaya Üniversitesi, Kadir Has Üniversitesi, GSM,MATLAB,Python,-, -, 6,
RF Tasarým Mühendisi, 6.630, 3.500, 10.840,Elektrik/Elektronik Mühendisliði, Elektronik ve Haberleþme Müh., Elektronik Mühendisliði, Telekomünikasyon Mühendisliði, Fizik Mühendisliði, Üretim / Endüstriyel Ürünler, Elektrik & Elektronik, Telekomünikasyon, Biliþim, Yapý, Hacettepe Üniversitesi, Ýhsan Doðramacý Bilkent Üniversitesi, Ýstanbul Teknik Üniversitesi (ÝTÜ), Yýldýz Teknik Üniversitesi (YTÜ), Orta Doðu Teknik Üniversitesi (ODTÜ), Altium Desinger,AutoCAD,Baský Devre Tasarýmý,Bilgisayar Destekli Tasarým Araçlarý,C++,9,
Risk Deðerlendirme Uzmaný, -, -, -, -, -, -, -, -, -, -, -, -, -, -, -, -, -, -, -, -, -, -, -, -,
Risk Ýzleme Uzmaný, 5.080, 2.500, 7.960,Ýþletme, Ýktisat, Maliye, Ýstatistik, Bankacýlýk ve Sigortacýlýk (MYO), Finans - Ekonomi, Eðlence - Kültür - Sanat, Danýþmanlýk, Taþýmacýlýk, Telekomünikasyon, Anadolu Üniversitesi, Sakarya Üniversitesi, Gazi Üniversitesi, Kocaeli Üniversitesi, Ondokuz Mayýs Üniversitesi, Bankacýlýk/Finans,Bilanço analizi,Finansal Risk Yönetimi,Kredi analizi,Mali tablolar analizi,4,
Risk Müdürü, 12.530, 10.000, 16.040,Ýþletme, Ekonomi, Ýktisat (Ýngilizce), Ýnþaat Mühendisliði, Uluslararasý Ýliþkiler, Finans - Ekonomi, Sigortacýlýk, Danýþmanlýk, Telekomünikasyon, Enerji, Ýstanbul Üniversitesi (ÝÜ), Boðaziçi Üniversitesi, Orta Doðu Teknik Üniversitesi (ODTÜ), Ýstanbul Teknik Üniversitesi (ÝTÜ), Marmara Üniversitesi, Finans,Finansal Analiz,Finansal Risk Yönetimi,Genel Muhasebe,ISO 27001 (Bilgi Güvenliði),6,
Risk Mühendisi, 7.270, 6.000, 8.740,Makine Mühendisliði, Ýnþaat Mühendisliði, Endüstri Mühendisliði, Çevre Mühendisliði, Jeoloji Mühendisliði, Sigortacýlýk, Yapý, Enerji, Telekomünikasyon, Hizmet, Yýldýz Teknik Üniversitesi (YTÜ), Ýstanbul Teknik Üniversitesi (ÝTÜ), Kocaeli Üniversitesi, Çukurova Üniversitesi, Karadeniz Teknik Üniversitesi (KTÜ), AutoCAD,Catia,Ýþ ve süreç analizi,Proje Yönetimi,Raporlama,10,
Risk Uzmaný, 5.870, 2.740, 9.010,Matematik, Ekonomi, Ýnþaat Mühendisliði, Uluslararasý Ýliþkiler, Kamu Yönetimi, Finans - Ekonomi, Sigortacýlýk, Danýþmanlýk, Enerji, Telekomünikasyon, Boðaziçi Üniversitesi, Ýstanbul Üniversitesi (ÝÜ), Ýhsan Doðramacý Bilkent Üniversitesi, Orta Doðu Teknik Üniversitesi (ODTÜ), Marmara Üniversitesi, Attention To Detail,Finansal Risk Yönetimi,MS Access,R Programming Language,Risk analizi,8,
Risk Yönetim Uzmaný, 4.860, 2.400, 7.450,Ýþletme, Matematik, Ýktisat, Endüstri Mühendisliði, Ýstatistik, Finans - Ekonomi, Sigortacýlýk, Telekomünikasyon, Biliþim, Üretim / Endüstriyel Ürünler, Marmara Üniversitesi, Orta Doðu Teknik Üniversitesi (ODTÜ), Dokuz Eylül Üniversitesi, Anadolu Üniversitesi, Hacettepe Üniversitesi, Finansal Raporlama,Finansal Risk Yönetimi,Genel Muhasebe,Ýstatistiksel analiz,MATLAB,12,
Romatoloji Uzmaný, -, -, -, -, -, -, -, -, -, -, -, -, -, -, -, -, -, -, -, -, -, -, -, -,
Röntgen Teknikeri, 3.400, 2.600, 5.020,Týbbi Görüntüleme Teknikleri, Radyoloji (MYO), Biyomedikal Cihaz Teknolojisi (MYO), Radyoterapi (MYO), Týbbi Dokümantasyon ve Sekreterlik (MYO), Saðlýk, Hizmet, Sigortacýlýk, Tekstil, Danýþmanlýk, Ýstanbul Üniversitesi (ÝÜ), Selçuk Üniversitesi, Ondokuz Mayýs Üniversitesi, Bahçeþehir Üniversitesi, Fýrat Üniversitesi, HTML,Otomasyon Sistemleri,PHP,Röntgen,STOK TAKÝBÝ,5,
Röntgen Teknisyeni, -, -, -, Týbbi Görüntüleme Teknikleri, Radyoloji (MYO), Biyomedikal Cihaz Teknolojisi (MYO), Ýktisat, Bilgisayar Teknolojisi ve Programlama (MYO), Saðlýk, Hizmet, Sigortacýlýk, Topluluklar, Denizcilik, Anadolu Üniversitesi, Hacettepe Üniversitesi, Afyon Kocatepe Üniversitesi, Ýstanbul Üniversitesi (ÝÜ), Marmara Üniversitesi, Bilgisayar Destekli Tasarým Araçlarý,Elektrik/Elektronik,Röntgen,-, -, -,
Ruhsatlandýrma Uzmaný, 5.580, 3.730, 7.430,Kimya, Kimya Mühendisliði, Eczacýlýk, Biyoloji, Veteriner, Saðlýk, Kimya, Danýþmanlýk, Tarým / Ziraat, Yapý, Ýstanbul Üniversitesi (ÝÜ), Ýstanbul Teknik Üniversitesi (ÝTÜ), Hacettepe Üniversitesi, Yýldýz Teknik Üniversitesi (YTÜ), Ege Üniversitesi, GCMS / HPLC,Gýda Mevzuatý,GMP,ISO 9001,Ýþçi Saðlýðý ve Ýþ Güvenliði,51,
Rusça Öðretmeni, 3.340, 2.500, 4.630,Rus Dili ve Edebiyatý, Mütercim-Tercümanlýk (Rusça), Uluslararasý Ýliþkiler, Ýngiliz Dili ve Edebiyatý, Sýnýf Öðretmenliði, Eðitim, Danýþmanlýk, Turizm, Yapý, Hizmet, Ankara Üniversitesi, Gazi Üniversitesi, Selçuk Üniversitesi, Erciyes Üniversitesi, Anadolu Üniversitesi, Adobe Photoshop,CorelDraw,Dýþ Ticaret,-, -, 9,
Saç Bakým Uzmaný, 2.830, 2.500, 3.700,Saç Bakýmý ve Güzellik Hizmetleri, Cilt Bakýmý ve Güzellik (MYO), Ýþletme, Pazarlama (MYO), Ýktisadi Ýdari Ýlimler, Saðlýk, Kimya, Hizmet, Ticaret, Eðitim, Anadolu Üniversitesi, Adnan Menderes Üniversitesi, Dicle Üniversitesi, Mersin Üniversitesi, Bülent Ecevit Üniversitesi, Muhasebe,Üretim Elemaný,-, -, -, 3,
Saç Ekim Uzmaný, 4.250, 4.000, 5.000,Biyoloji, Anestezi Teknikerliði (MYO), Týbbi Laboratuvar (MYO), Anestezi (MYO), Ameliyathane Teknikerliði (MYO), Saðlýk, Hizmet, Sigortacýlýk, Turizm, Kimya, Anadolu Üniversitesi, Marmara Üniversitesi, Ýstanbul Üniversitesi (ÝÜ), Niþantaþý Üniversitesi, Karadeniz Teknik Üniversitesi (KTÜ), MS Excel,Araþtýrmacý,Spor Yapma,Team Work,Genel Kültür,5,
Saç Tasarýmcýsý, 4.250, 2.500, 8.150,Büro Yönetimi ve Yönetici Asistanlýðý (MYO), Kuaförlük (MYO), Tiyatro, Konaklama ve Turizm Ýþletmeciliði, Makine-Resim-Konstrüksiyon (MYO), Saðlýk, Kimya, Hizmet, Eðlence - Kültür - Sanat, Turizm, Anadolu Üniversitesi, Niþantaþý Üniversitesi Meslek Yüksekokulu, Ýstanbul Üniversitesi (ÝÜ), Selçuk Üniversitesi, Sakarya Üniversitesi, 3D Tasarým ve Modelleme Uygulamasý,Genel Muhasebe,ISIS PROTEUS / ARES,Ýþ Zekasý,Satýþ Yönetimi,4,
Saðlýk Memuru, 3.190, 2.090, 4.290,Saðlýk Memurluðu, Hemþirelik ve Saðlýk Hizmetleri, Saðlýk Kurumlarý Ýþletmeciliði, Laborant ve Veteriner Saðlýk  (MYO), Týbbi Laboratuvar (MYO), Saðlýk, Hizmet, Yapý, Sigortacýlýk, Çevre, Anadolu Üniversitesi, Kocaeli Üniversitesi, Atatürk Üniversitesi, Gülhane Askeri Týp Akademisi, Pamukkale Üniversitesi, Ýþçi Saðlýðý ve Ýþ Güvenliði,Photoshop,-, -, -, 41,
Saðlýk Personeli, 2.590, 2.020, 3.250,Yaþlý Hizmetleri Bakýmý (MYO), Týbbi Laboratuvar (MYO), Ýlk ve Acil (Paramedik), Hemþirelik ve Saðlýk Hizmetleri, Týbbi Dokümantasyon ve Sekreterlik (MYO), Saðlýk, Hizmet, Sigortacýlýk, Çevre, Yapý, Anadolu Üniversitesi, Atatürk Üniversitesi, Ýstanbul Üniversitesi (ÝÜ), Adnan Menderes Üniversitesi, Cumhuriyet Üniversitesi, Ýþçi Saðlýðý ve Ýþ Güvenliði,-, -, -, -, 36,
Saðlýk Teknikeri, 2.600, 2.020, 3.600,Yaþlý Hizmetleri Bakýmý (MYO), Týbbi Dokümantasyon ve Sekreterlik (MYO), Týbbi Laboratuvar (MYO), Aðýz ve Diþ Saðlýðý (MYO), Týbbi Görüntüleme Teknikleri, Saðlýk, Hizmet, Sigortacýlýk, Hayvancýlýk, Yapý, Anadolu Üniversitesi, Sakarya Üniversitesi, Cumhuriyet Üniversitesi, Adnan Menderes Üniversitesi, Karamanoðlu Mehmetbey Üniversitesi, Ýþçi Saðlýðý ve Ýþ Güvenliði,Sterilizasyon,-, -, -, 9,
Saðlýk Teknisyeni, 2.410, 2.300, 2.590,Biyoloji, Yaþlý Hizmetleri Bakýmý (MYO), Elektronörofizyoloji (MYO), Týbbi Dokümantasyon ve Sekreterlik (MYO), Saðlýk Kurumlarý Ýþletmeciliði, Saðlýk, Hizmet, Sigortacýlýk, Eðitim, Yapý, Anadolu Üniversitesi, Çukurova Üniversitesi, Ýstanbul Üniversitesi (ÝÜ), Gazi Üniversitesi, Atatürk Üniversitesi, Ýþçi Saðlýðý ve Ýþ Güvenliði,Sterilizasyon,Wireless,-, -, 5,
Saha Destek Elemaný, 2.720, 2.020, 3.470,Ýþletme, Elektrik (MYO), Bilgisayar Programcýlýðý, Bilgisayar Teknolojisi ve Programlama (MYO), Kamu Yönetimi, Biliþim, Telekomünikasyon, Elektrik & Elektronik, Hizmet, Reklam ve Tanýtým, Anadolu Üniversitesi, Atatürk Üniversitesi, Ýstanbul Üniversitesi (ÝÜ), Dokuz Eylül Üniversitesi, Sakarya Üniversitesi, Adobe Photoshop,C Programming Language,C#,Genel Muhasebe,Muhasebe,48,
Saha Mühendisi, 4.260, 2.030, 6.490,Ýnþaat Mühendisliði, Makine Mühendisliði, Elektrik/Elektronik Mühendisliði, Jeoloji Mühendisliði, Ýnþaat (MYO), Yapý, Enerji, Elektrik & Elektronik, Hizmet, Maden ve Metal Sanayi, Yýldýz Teknik Üniversitesi (YTÜ), Karadeniz Teknik Üniversitesi (KTÜ), Ýstanbul Teknik Üniversitesi (ÝTÜ), Sakarya Üniversitesi, Kocaeli Üniversitesi, AutoCAD,C++,Hakediþ Düzenlenmesi,ideCAD Statik,MATLAB,435,
Saha Operasyon Elemaný, 2.840, 2.020, 3.680,Ýþletme, Elektrik (MYO), Dýþ Ticaret (MYO), Lojistik (MYO), Bilgisayar Teknolojisi ve Programlama (MYO), Taþýmacýlýk, Telekomünikasyon, Denizcilik, Enerji, Hizmet, Anadolu Üniversitesi, Kocaeli Üniversitesi, Trakya Üniversitesi, Sakarya Üniversitesi, Çukurova Üniversitesi, AutoCAD,Elektrik/Elektronik,-, -, -, 31,
Saha Satýþ Elemaný, 2.630, 2.020, 3.590,Ýþletme, Ýktisat, Kamu Yönetimi, Dýþ Ticaret (MYO), Pazarlama (MYO), Gýda, Biliþim, Telekomünikasyon, Enerji, Finans - Ekonomi, Anadolu Üniversitesi, Selçuk Üniversitesi, Akdeniz Üniversitesi, Atatürk Üniversitesi, Ýstanbul Üniversitesi (ÝÜ), Saha Satýþ,Satýþ Yönetimi,-, -, -, 60,
Saha Satýþ Müdürü, 7.360, 3.960, 11.020,Ýþletme, Makine Mühendisliði, Ýktisat, Uluslararasý Ýliþkiler, Ýþletme (Ýngilizce), Enerji, Gýda, Taþýmacýlýk, Yapý, Otomotiv, Anadolu Üniversitesi, Ýstanbul Üniversitesi (ÝÜ), Yýldýz Teknik Üniversitesi (YTÜ), Dokuz Eylül Üniversitesi, Uludað Üniversitesi, AutoCAD,Bütçe planlama ve raporlama,Cari Hesap ve Finans Takibi,CRM,Depo Ve Lojistik Yönetimi,26,
Saha Satýþ Temsilcisi, 2.980, 2.020, 4.630,Ýþletme, Ýktisat, Kamu Yönetimi, Pazarlama (MYO), Ýþletme Yönetimi, Gýda, Telekomünikasyon, Biliþim, Finans - Ekonomi, Saðlýk, Anadolu Üniversitesi, Selçuk Üniversitesi, Kocaeli Üniversitesi, Ýstanbul Üniversitesi (ÝÜ), Manisa Celal Bayar Üniversitesi, AutoCAD,Pazarlama Stratejisi,Saha Satýþ,Satýþ Yönetimi,-, 45,
Saha Satýþ Uzmaný, 3.370, 2.020, 5.070,Ýþletme, Ýktisat, Kamu Yönetimi, Pazarlama, Dýþ Ticaret (MYO), Biliþim, Telekomünikasyon, Gýda, Saðlýk, Güvenlik, Anadolu Üniversitesi, Ýstanbul Üniversitesi (ÝÜ), Dokuz Eylül Üniversitesi, Kocaeli Üniversitesi, Uludað Üniversitesi, AutoCAD,Logo Tiger,Müþteri Hizmetleri Operasyon Yönetimi,Saha Satýþ,Satýþ Yönetimi,47,
Sanal Gerçeklik Uzmaný, -, -, -, -, -, -, -, -, -, -, -, -, -, -, -, -, -, -, -, -, -, -, -, -,
Sanat Yönetmeni, 4.470, 2.570, 6.380,Grafik Tasarýmý, Grafik, Güzel Sanatlar, Resim, Görsel Ýletiþim Tasarýmý, Reklam ve Tanýtým, Medya, Eðlence - Kültür - Sanat, Biliþim, Basým - Yayýn, Anadolu Üniversitesi, Marmara Üniversitesi, Mimar Sinan Güzel Sanatlar Üniversitesi, Ýstanbul Üniversitesi (ÝÜ), Dokuz Eylül Üniversitesi, Adobe After Effects,Adobe Dreamweaver,Adobe Flash,Adobe Illustrator,Adobe Indesign,27,
